timestamp,text,url,score,num_comments,id,source,subreddit,coin,lang,sentiment,price,sma_20,sma_50,rsi_14,macd,macd_signal,macd_hist
2025-08-25 20:39:54,"i had £50 in btc that i bought 3-4 years ago. totally forgot about it. randomly logged in first time in a while and it was worth £303. i’m skint and needed a new washing machine.

btc literally saved my arse.

every pay day i will now invest.

gg btc gg",https://www.reddit.com/r/Bitcoin/comments/1n01znh/i_had_50_in_btc_that_i_bought_34_years_ago/,117,8,1n01znh,reddit,Bitcoin,btc,en,0.7717,110004.8647010217,,,,0.0,0.0,0.0
2025-08-25 21:00:29,"what else can we do? i recently bought btc at about 117k. then panic sold when it hit 114. and bought again at 115. as i know myself , i decided to move everything to a cold wallet (it was in the exchange).
if it hits below 110k do you know what am i gonna do? yessss… i’m gonna dca my life out. the decision is taken. otherwise, as the title says, what else?",https://www.reddit.com/r/Bitcoin/comments/1n02j6g/what_else_can_we_do/,0,47,1n02j6g,reddit,Bitcoin,btc,en,-0.5913,109561.09710118636,,,,-35.40026437434426,-7.080052874868852,-28.32021149947541
2025-08-25 21:13:21,why bitcoin treasury companies are a fool’s paradise,https://www.ft.com/content/478ea5bc-ea18-44f7-9da1-602ebe283fca,2,3,1n02vge,reddit,Bitcoin,btc,en,0.7184,109614.7770388255,,,,-58.449932156538125,-17.354028731202707,-41.09590342533542
2025-08-25 21:34:55,"100k investment help i have 100k to invest in crypto (better now than ever), most of my money is in stocks but finally decided to allocate some.

thought to allocate 50k on btc, 40k on eth and 10k on xrp, just because these look the most “stable” and promising for a long time investment.

1.	⁠is this the right allocation, or would you change something? remember i’m looking for fairly stable and promising currencies rather than meme coins.
2.	⁠i keep reading that in september everything will go down (good time to buy?) , on the other hand i hear that 2026 there is going to be a crash before the next run. so the question is - how to time the buy?

thanks!",https://www.reddit.com/r/CryptoMarkets/comments/1n03frc/100k_investment_help/,27,85,1n03frc,reddit,CryptoMarkets,btc,en,0.9582,109442.6884803834,,,,-89.57055479998235,-31.797333944958638,-57.77322085502371
2025-08-25 21:35:50,"was bitcoin also your introduction on the concept of infinite and finite currencies too? i can't imagine many people outside of economists would understand. why have i never heard about this issue before? we all learn about taxes and inflation but i don't remember anyone talking about what we the people need is a kind of currency that can't be reproduced from nothing. it's like bitcoin is largely solving a problem the common ~~dumbass~~ citizen wasn't even aware of and that's a big part of why it's not being accepted the way i thought it would be. idk man, it's staggering to me trying to talk to people about it. i brought it up to my chiropractor and his opinion is that because it's digital it can't really replace anything as a currency. i guess i'll let him figure it out in his time. anyway thanks for reading my rant and happy stacking.",https://www.reddit.com/r/Bitcoin/comments/1n03gkz/was_bitcoin_also_your_introduction_on_the_concept/,12,6,1n03gkz,reddit,Bitcoin,btc,en,0.3013,109442.6884803834,,,,-112.93206194457889,-48.02427954488269,-64.9077823996962
2025-08-25 22:10:47,"don’t hide cash at home: use cryptocurrencies instead / how crypto is the alternative to the system you've been seeking all along tl;dr: this article is more aimed at beginners and people fearful of crypto (but then, the bitcoin beginner subreddit does not allow articles, only questions), and explores options on how and why cryptocurrencies can bring freedom to one's finances, and be an alternative to people who sought to get away from official institutions by keeping their money at home.",https://medium.com/technology-hits/dont-hide-cash-at-home-use-cryptocurrencies-instead-d698a2e75817?sk=v2%2F205260cd-20db-41f1-be1b-03f769f1c03b,105,1,1n04ca5,reddit,Bitcoin,btc,en,-0.0941,110069.68524569672,,,,-79.93142601355794,-54.40570883861774,-25.525717174940198
2025-08-26 00:43:49,"has anyone seen this symbol in relation to bitcoin? https://preview.redd.it/vjlk5p90g9lf1.png?width=878&format=png&auto=webp&s=58d6e7a04ec399c15ebe006672cc40f7e3dedfb5

found on an envelope. it is either bitcoin or crypto related to some capacity.",https://www.reddit.com/r/Bitcoin/comments/1n07v6e/has_anyone_seen_this_symbol_in_relation_to_bitcoin/,0,3,1n07v6e,reddit,Bitcoin,btc,en,0.0,109489.25875871583,,,,-99.46715550181398,-63.41799817125699,-36.04915733055699
2025-08-26 00:51:05,"what do i do with bitcoin now hey guys, i'm just starting out in the market and i saw that bitcoin is falling. i would like your opinion: is it worth buying heavily now, waiting to see if it drops more or selling everything at once?",https://www.reddit.com/r/Bitcoin/comments/1n080z4/what_do_i_do_with_bitcoin_now/,0,34,1n080z4,reddit,Bitcoin,btc,en,0.4215,109382.59978794768,,,,-122.14780555528705,-75.16395964806301,-46.98384590722404
2025-08-26 01:10:56,"pay attention ""btc is dead"" shouters, paper hands and newbies. https://preview.redd.it/mmrpg2c0j9lf1.png?width=1220&format=png&auto=webp&s=f3c16a171bcb2c85d21755dbfe2b23430c9c9ba1

first of all here is the link to the page for the picture above: [https://bitbo.io/dead/](https://bitbo.io/dead/)  
another eye opener: [https://bitcoindeaths.com/](https://bitcoindeaths.com/)

  
i recently saw a lot of people looking at btc hitting ath and then continuing with a correction, and people asking ""i just bought should i sell??"", ""bull market is over? i will buy at 50k!"". first, if you're looking to make big money with btc fast, you are investing in an asset class that you do not understand and is probably not good for your mental health. all these people you see who made millions off of bitcoin, gaining freedom, being mortgage free, they all started somewhere. you are telling me, you are skeptical about btc after it is correcting from an ath of $123,000? the stories you see from people are the ones who once believed in btc when it was at $100 or even $10,000, it was the exact same situation, no one knew what's going to happen, fud in the market was still at its peak.   
  
there are many people who have shared plethora of resources to learn about btc, books like ""the bitcoin standard"", ""broken money"" and videos like ""what's the problem?"" and websites like [https://www.satsvsfiat.com/](https://www.youtube.com/redirect?event=video_description&redir_token=quffluhqbtjqvwdvdtffaevdt0l4zm9sddhhy2fbdvfjd3xbq3jtc0ttanhrung1lwizbfpwdxvun2o2nknetnztetg4rfdwymlobu5hak5rn0znshlmdjlrb3zoenjuetl1sv9dukrettdny3lymhbsuzayd21kuv94yy1jqnzozwjymmjku2r0zxncltftbxvpnvfwtxewwq&q=https%3a%2f%2fwww.satsvsfiat.com%2f&v=ytfoxnbmd38). before you see the $$$ signs attached next to btc, understand what it is about, why satoshi nakamoto believed in such an idea and decided to share it with the world, why he saw a world where everyone had freedom, where everyone would not work till death against a system that is designed to make them lose. and if you still wish to make $$$ off of bitcoin then at least understand it is not a get rich quick scheme, it is a lesson that patience and perseverance wins, as bitcoin always has against every skeptic, every action of unethical exchanges and attempts of governments to ban it (like the china mining ban a few years back). open your eyes, see the reality. that paper money in your hand is making you weak and the sad part is the more you get of it, the more you believe in it.   
  
i hope you all find the strength to get out of the fiat system that is already rigged against you and understand that true value of life is not how much bank you make, or how much your btc holding is in $$$, but of how free you can be in a world where slavery has become a socially accepted behaviour.",https://www.reddit.com/r/Bitcoin/comments/1n08gsx/pay_attention_btc_is_dead_shouters_paper_hands/,125,21,1n08gsx,reddit,Bitcoin,btc,en,0.7236,109507.38849058,,,,-128.57089350053866,-85.84534641855815,-42.72554708198051
2025-08-26 01:20:31,bitcoin & the machine state ritual,https://johnbmint.substack.com/p/bitcoin-and-the-machine-state-ritual,5,2,1n08oh2,reddit,Bitcoin,btc,en,0.0,109396.10230855813,,,,-141.0155621830345,-96.87938957145343,-44.13617261158106
2025-08-26 01:52:51,limited bc question hey so i'm rather new to bitcoin but have been following for a long time. i have a question regarding it's divisibility. sure bc is only 21 million but it's also divisible to infinity. how is does mean there is any kind of limited supply? please help me out here. how am i not a sucker for buying .0002 bitcoins when .00002 might be just around the corner. need some professional help here.,https://www.reddit.com/r/Bitcoin/comments/1n09dmw/limited_bc_question/,0,34,1n09dmw,reddit,Bitcoin,btc,en,0.9308,109888.87712097097,,,,-109.84897213002841,-99.47330608316844,-10.375666046859976
2025-08-26 02:13:41,"don’t panic! i made this simple, crystal-clear bitcoin chart to guide beginners through these uncertain times 🚀",https://i.redd.it/0yheqq42w9lf1.jpeg,330,32,1n09tr5,reddit,Bitcoin,btc,en,-0.6996,109982.6199719098,,,,-76.70080124858941,-94.91880511625264,18.218003867663228
2025-08-26 02:45:59,someone at my local steak n shake likes bitcoin first the window sticker now the wall! neat-o,https://i.redd.it/dpmiucly1alf1.jpeg,19,4,1n0ahqx,reddit,Bitcoin,btc,en,0.3382,109724.53153688488,,,,-70.4441801184148,-90.02388011668508,19.57969999827027
2025-08-26 03:41:27,"bitcoin keeps steady at 100k is actually good for us with < 1btc bitcoin keeps steady ad 100k is actually a good things for those who own less than 1 btc. considering bitcoin goes rocket high, said 10m, but for those who only own 0.1 or 0.01 btc, this amount is still not big enough to set one free. on the contrary, if we can stacks sats at this level for a longer time of period, it will be better for the future.",https://www.reddit.com/r/Bitcoin/comments/1n0bkmn/bitcoin_keeps_steady_at_100k_is_actually_good_for/,0,10,1n0bkmn,reddit,Bitcoin,btc,en,0.9042,109861.06325908208,,,,-53.84806686259981,-82.78871746586802,28.94065060326821
2025-08-26 04:03:53,"just sold a bunch of stuff in time for buying the dip. i just sold 3 babulabs 3d printers, along with some old camera gear and sonos speakers, to free up cash and buy the dip.

my average purchase price is around **$115,500**. like everyone else, i’m down right now, but the fundamentals of bitcoin are just too hard to ignore.

this isn’t about *trading* bitcoin. it’s about *understanding* it. the fundamentals speak for themselves. when stablecoins became regulated and the u.s. decided to ban the creation of a government-backed cryptocurrency, the writing on the wall became clear to me.

bitcoin is about fundamentals. that’s why i’m here.

wishing you all strong conviction and diamond hands, i’m hodling right alongside you.",https://www.reddit.com/r/Bitcoin/comments/1n0bzzg/just_sold_a_bunch_of_stuff_in_time_for_buying_the/,15,10,1n0bzzg,reddit,Bitcoin,btc,en,0.8442,109919.90245662886,,,48.696766258349754,-35.538035682810005,-73.33858110925641,37.800545426446405
2025-08-26 04:08:29,"to the more experienced hodlers at what price do you guys think this dip will bottom out at?

i'm not super familiar with these dips in the cycle, but i do want to get the most btc i can with the money i'm putting in.

why would i continue to put money in at $112k, or $109k if the community thinks the dip will bottom at $90k. i'd rather wait and put lump sums in at $100k or $95k or whatever i think is relatively close to the bottom.

edit:

thank you for those first few commentors who have been treating this as an opportunity to educate. i appreciate you! keep providing input!

i don't have disposable income at this point i my life, so it feels a little scary even though i believe bitcoin is the currency of the future. it's not a lack of faith.",https://www.reddit.com/r/Bitcoin/comments/1n0c308/to_the_more_experienced_hodlers/,0,38,1n0c308,reddit,Bitcoin,btc,en,0.7223,110002.70785153998,,,57.617372080763104,-14.182019230691367,-61.507268733543405,47.32524950285204
2025-08-26 04:17:03,"started stacking 22 days ago, just reached 1% of a bitcoin :) 5% is the next goal",https://www.reddit.com/gallery/1n0c8na,482,64,1n0c8na,reddit,Bitcoin,btc,en,0.5267,110121.45664893671,,,58.54787035612951,12.184359482605942,-46.768943090313535,58.953302572919476
2025-08-26 04:22:52,this is a bitcoin coin made from 1 oz 99.99% silver👍📈🚀,https://www.reddit.com/gallery/1n0cceg,0,8,1n0cceg,reddit,Bitcoin,btc,en,0.0,110109.30561765825,,,61.88757725031453,31.733612566429656,-31.068431958964894,62.80204452539455
2025-08-26 05:05:59,"i just bought btc for the first time! hey guys, i know prob no one cares about this but i just wanted to share that i finally bought some bitcoin for the first time :)

this is the start of my stacking journey and i’m planning to dca every week no matter what happens. i know september usually isn’t the best month and price might go down a lot, but i’m in this for the long term so i don’t really mind.

kinda excited to finally be a part of this journey instead of just watching from the sidelines. let’s see where this goes :)",https://www.reddit.com/r/Bitcoin/comments/1n0d3t0/i_just_bought_btc_for_the_first_time/,76,18,1n0d3t0,reddit,Bitcoin,btc,en,0.9623,110116.97985799728,,,61.991608009101945,47.30053244471492,-15.394639078228934,62.69517152294385
2025-08-26 05:16:08,"is this a right time to go all-in or will it be cheaper in future? my money was on interest, now i got it back and don't know what to do with it, i was waiting bitcoin drop to 90k but i feel like this might be the last chance to see bitcoin at 110k and it will never go below 100k. what do you say, should i go all in or wait for a while for a better chance? (and no i'm not going to split the money)",https://www.reddit.com/r/Bitcoin/comments/1n0d9v0/is_this_a_right_time_to_go_allin_or_will_it_be/,0,37,1n0d9v0,reddit,Bitcoin,btc,en,0.8782,110239.80518775592,109793.91999513315,,53.68649144100635,68.75583178941451,1.435455095299755,67.32037669411476
2025-08-26 05:20:37,bitcoin,https://i.redd.it/ceczb5tjtalf1.jpeg,7,2,1n0dckj,reddit,Bitcoin,btc,en,0.0,110239.80518775592,109805.66701946987,,71.73083617468495,84.78199701060657,18.10476347836112,66.67723353224545
2025-08-26 06:09:56,"daily discussion, august 26, 2025 please utilize this sticky thread for all general **bitcoin** discussions! if you see posts on the front page or /r/bitcoin/new which are better suited for this daily discussion thread, please help out by directing the op to this thread instead. thank you!

if you don't get an answer to your question, you can try phrasing it differently or commenting again tomorrow.

please check the [previous discussion thread](https://www.reddit.com/r/bitcoin/comments/1mzjmsg/mentor_monday_august_25_2025_ask_all_your_bitcoin/) for unanswered questions.",https://www.reddit.com/r/Bitcoin/comments/1n0e5kl/daily_discussion_august_26_2025/,26,56,1n0e5kl,reddit,Bitcoin,btc,en,0.9272,110132.97104416616,109834.26071661888,,71.72356076526388,87.84955093445024,32.05372096957895,55.79582996487129
2025-08-26 06:29:57,"easy way to buy bitcoin hi all,

i don’t have a lot of money but i want to put a little bit on bitcoin. which app is the easiest and cheapest to buy bitcoin. i am not in the us. thank you.",https://www.reddit.com/r/Bitcoin/comments/1n0egwk/easy_way_to_buy_bitcoin/,0,3,1n0egwk,reddit,Bitcoin,btc,en,0.8537,110015.7275004972,109854.30823970246,,64.78120109017456,79.899009346409,41.62277864494496,38.276230701464044
2025-08-26 06:34:24,bitcoin core vs. bitcoin knots: the silent duel of the code's guardians.,https://inbitcoinwetrust.substack.com/p/bitcoin-core-vs-bitcoin-knots-the,2,1,1n0ejgw,reddit,CryptoMarkets,btc,en,0.0,110039.745526793,109884.16109202293,,69.71610857330441,74.6753904352372,48.23330100300341,26.442089432233793
2025-08-26 06:41:29,tell me your holding through btc winter stories winter is coming,https://i.redd.it/d7mtcx5y7blf1.png,0,24,1n0ench,reddit,Bitcoin,btc,en,0.0,110048.84905484151,109914.46912074585,,56.96374127882179,70.4580172815331,52.678244258709356,17.779773022823747
2025-08-26 07:20:24,what does this comic mean? this was in bitcoin magazine in november 2024. barnes & noble california. i remember i took this picture why? because i didn’t quite understand what it was saying. but i took the picture because i do like it. it has a hopeful feeling.,https://i.redd.it/56rthm1xeblf1.jpeg,95,50,1n0f8jf,reddit,Bitcoin,btc,en,0.8959,109848.47833654826,109903.40877528842,,44.656708478948474,50.366878254149924,52.215971057797475,-1.849092803647551
2025-08-26 07:26:56,"recovered my dad’s old blockchain.com wallet (14 btc), but stuck with forgotten password – need advice hey everyone,

i’m both excited and frustrated right now. after weeks of digging, i found that my dad actually bought around **14 btc back in 2015** on blockchain.com. the good news: i managed to recover access to the **email and keystore file** (not json, but the encrypted keystore). the bad news: nobody remembers the password.

here’s where i’m at:

* i’ve tried some tools like **btcrecover** and **hashcat**.
* i have some **password hints** from my dad’s old saved browser passwords (so i’m not shooting completely in the dark).
* i know some services claim they can crack wallets, but most look sketchy and i’d rather not trust strangers with this.

my question:

* has anyone here had **success stories** recovering a blockchain.com wallet with password hints?
* is it realistic to attempt this myself, or is it a dead end without professional help?
* if there are trusted communities or resources you recommend (guides, success stories, etc.), please point me there.

i’m not asking anyone to crack it for me — just want to know what’s actually worked for people and if there’s a **sane path forward** before i waste months on the wrong approach.

thanks in advance 🙏

## update 1 

 just wanted to share where i’m at and hopefully get some feedback:
* i figured out this is a non-custodial wallet. so if i don’t get the password, there’s no recovery option from blockchain.com.

* i went to blockchain.com, logged in with the wallet id, and by entering a wrong password i was able to get back the wallet.aes.json file (encrypted wallet backup).

* i have around 20 base password variations that my dad typically used. using those, i generated about 1 million variants with the help of tools + llms.

* i tried those against the wallet.aes.json using btcrecover (cpu-based), but no luck so far.

my next step: i want to move this to hashcat (gpu-based) so i can test more possibilities.

now i’m considering a few approaches, and would love input from anyone who’s been through something similar:

* expand the wordlist: take my 20 known password hints and generate ~20–50 million variations (instead of just 1m) and run them in hashcat.

* pattern-based attack: try to define regex-style rules or patterns in hashcat, based on what i know about my dad’s password habits, instead of just a big flat wordlist.

other smarter approach? maybe i’m missing a more efficient way to combine hints + patterns so i’m not brute forcing blindly.

so my question is: what’s realistically the best way forward here? is it worth generating massive wordlists, or should i focus on getting good rules/patterns for hashcat?

any tweaks, tips, or alternative methods are welcome 🙏",https://www.reddit.com/r/Bitcoin/comments/1n0fc41/recovered_my_dads_old_blockchaincom_wallet_14_btc/,1038,339,1n0fc41,reddit,Bitcoin,btc,en,0.9803,109806.68977323048,109919.28032601415,,53.95396712553926,30.718415238632588,47.9164598939645,-17.198044655331913
2025-08-26 07:56:24,"ethereum at all-time highs, altcoin season on the horizon. which microcaps are you watching? with ethereum climbing close to new all-time highs and bitcoin dominance showing some interesting movements, many in the space are already preparing for the long-awaited altcoin season.

historically, when eth gains momentum, capital tends to flow into mid-caps and eventually into microcaps. we’re already seeing strong signs of stabilization and consolidation across the market – the kind of setup that often precedes explosive altcoin runs.

i’ve been researching different microcaps in the rwa (real-world asset) sector since that narrative is gaining traction. one example is **rem**, a utility token focused on real estate metaverse integration. it’s still tiny compared to others, but i find the microcap/rwa combo interesting given how eth dominance is shaping up.

curious to hear your thoughts:

* do you think this eth rally will trigger a proper altcoin season?
* which sectors (ai, rwa, gaming, defi) do you think will benefit the most?
* are there any microcaps you’re personally keeping an eye on?

let’s share some research and keep this a solid discussion for the community.",https://www.reddit.com/r/CryptoMarkets/comments/1n0fsb9/ethereum_at_alltime_highs_altcoin_season_on_the/,13,42,1n0fsb9,reddit,CryptoMarkets,btc,en,0.9761,110304.27215130757,109965.36394418214,,65.82905982032054,54.66743403048895,49.26665472126939,5.400779309219558
2025-08-26 08:05:24,"bitbox02 nova i’m planning on dca’ing into bitcoin for now, so i was looking at getting the bitbox02 nova bitcoin-only edition. the thing is, i’m not sure if i should just stick to that or get the multicoin version in case i decide to diversify later.

would it make more sense to just buy the bitcoin-only version now and, if i switch up later, get a different wallet for the other coins? or is it smarter to go with the multicoin version right away, even if i’m only holding btc for the foreseeable future?",https://www.reddit.com/r/Bitcoin/comments/1n0fx8x/bitbox02_nova/,0,3,1n0fx8x,reddit,Bitcoin,btc,en,0.3395,110306.2734164487,110005.3081904756,,64.38304859009611,72.9675646731921,54.00683671165393,18.96072796153817
2025-08-26 08:10:11,"large correction incoming? or manipulated shake-out? hi, just wanted to see where everyones heads at rn, i've been through countless shakeouts in my years in crypto and this feels just like one, however some technicals suggest that we could be heading to a potential month long correction.

my guess would be that there are still alot of fools who are longing with high leverage at every dip and making it easy for market makers/whales to flush out leverage and as soon as those fools are exhausted, we then go for the massive $30b in liquidations waiting at $130k btc. news has also suddenly turnt bearish, youtube comments are not calling this the 'market top', x comments are no longer saying $1000 xrp lol, these are all psychological signs that we are at a bottom from my experience  
  
but as always, the crypto market does the opposite of what i expect, so a long ass correction is also very possible

what do you think?",https://www.reddit.com/r/CryptoMarkets/comments/1n0fzrs/large_correction_incoming_or_manipulated_shakeout/,9,5,1n0fzrs,reddit,CryptoMarkets,btc,en,-0.8722,110296.6086361924,110050.3335068573,,61.57083922071373,85.70275504606252,60.346020378535655,25.356734667526865
