timestamp,text,url,score,num_comments,id,source,subreddit,coin,lang,sentiment,price,sma_20,sma_50,rsi_14,macd,macd_signal,macd_hist
2025-08-26 20:27:15,"bitcoin security vs nano security : transaction confirmation speed and irreversibility let's dive into one of the key differences between btc and xno (nano): 

how quickly and irreversibly transactions confirm.

bitcoin :
confirmations are *probabilistic*. each block adds security, but it's not instant. 

for high confidence (say, 6 confirmations to avoid double-spends), you're looking at ~1 hour on average (blocks every ~10 mins). it's secure but slow, not ideal for quick coffee buys.

reversals are possible in theory via chain reorgs, though rare in bitcoin but happening now in other pow chains 

nano

*deterministic* finality. using a block-lattice and open representative voting (orv), transactions confirm under 1 second! 

once voted on by reps, it's irreversible. no mining, no fees, feeless and eco-friendly. perfect for microtransactions or daily use.",https://www.reddit.com/r/CryptoMarkets/comments/1n0wwec/bitcoin_security_vs_nano_security_transaction/,1,1,1n0wwec,reddit,CryptoMarkets,btc,en,0.4172,111283.42953989288,110497.33885215936,110226.73207502234,80.55694693259005,308.85295028479595,227.1817805786315,81.67116970616445
2025-08-26 20:32:43,bitcoin is ‘funny internet money’ during a crisis: tezos co-founder,https://cointelegraph.com/magazine/tezos-blockchain-arthur-breitman-calls-bitcoin-funny-internet-money/,1,1,1n0x1mz,reddit,CryptoCurrency,btc,en,-0.6249,111347.49276998133,110576.25344105833,110257.54813495737,79.94058580032362,324.6966693074646,246.68475832439816,78.01191098306646
2025-08-26 20:34:40,"what's the best instant exchange to sell bitcoin i am mining bitcoin and want to hold as much as possible, but to keep my machines running i need to sell some. i do not like using p2p because it takes too long and i have had issues before. changenow froze one of my orders and that made me lose trust in the process.

i also do not trust centralized exchanges, so i avoid them completely. now that exch has shut down, i feel stuck without any reliable options left. is there any method that could help me sell without giving up control or going through all the hassle, something fast and secure that does not involve the usual problems i have faced?",https://www.reddit.com/r/Bitcoin/comments/1n0x3ix/whats_the_best_instant_exchange_to_sell_bitcoin/,1,0,1n0x3ix,reddit,Bitcoin,btc,en,0.1733,111347.49276998133,110649.5763668898,110278.41254733084,72.568927127695,333.409592538228,264.02972516716414,69.37986737106388
