timestamp,text,url,score,num_comments,id,source,subreddit,coin,lang,sentiment,price,sma_20,sma_50,rsi_14,macd,macd_signal,macd_hist
2025-08-26 15:05:08,"how cross-chain bridges work # tl;dr

* cross-chain bridges enable assets, data, and information to be transferred between isolated blockchain networks, providing interoperability.
* interoperability is crucial to unifying isolated blockchain ecosystems and improving user experiences.
* cross-chain bridges provide dapps and tokens with multi-chain strategies that can increase volume, liquidity, and profitability.
* token holders benefit from access to new opportunities, lower fees, and enhanced accessibility.

# understanding how cross-chain bridges work

a cross-chain bridge is a protocol that enables the transfer of assets, data, or information between various blockchain networks. it allows users to interact with different blockchains, unlocking interoperability by facilitating communication and transactions between otherwise isolated ecosystems. bridges are great for transferring tokens, using dapps across chains, and optimizing blockchain functionalities.

# what types of cross-chain bridges are there?

there are several types of bridges in the web3 space, each serving a different purpose and need. as these bridges serve different roles, they operate in different ways. here is a brief overview of different types of bridges: 

**trust-based bridges**

trust-based bridges depend on a centralized authority to facilitate cross-chain asset transfers. despite being less susceptible to hacking, trust-based bridges require trust in the authority. trust-based bridges can support any asset, and all cross-chain bridges tend to fall between the categories of trust-based bridges or trustless bridges.

**trustless bridges**

as its name suggests, trustless bridges operate without a central authority. in contrast, trustless bridges rely on nodes or smart contracts, depending on the type of bridge.

**wrapped asset and altcoin bridges**

many bridges focus on transferring wrapped assets and altcoins across different chains. many of the assets are wrapped versions of popular cryptocurrencies, such as wrapped bitcoin (wbtc), or less popular altcoins and tokens. bridging these assets cross-chain opens up trading and arbitrage opportunities, as well as a higher trading volume on dexs for the asset. 

**stablecoin bridges**

other bridges focus on various stablecoins such as usdt, usdc, and dai. some stablecoin bridges have integrated different bridging protocols, such as circle’s cctp for usdc or chainlink’s ccip, to allow the movement of these assets. 

**nft bridges**

while nfts may have lost some of their glamour, some bridges focus on transferring digital collectibles or nfts across chains. nft bridges tend to be relatively rare, as market interest in digital collectibles has died down, and meme coins have become the recent craze. 

# how do cross-chain bridges work?

there are several types of bridging methods used in cross-chain bridges, depending on the specific bridge. here are a few common methods:

**lock and mint bridging**

one of the most common ways cross-chain bridges work is by using a lock and mint functionality. in this method, tokens are locked on one chain, and an equivalent number of tokens is minted on the other. should the user want to bridge assets back to their original chain, the newly minted version of the tokens is burnt, and the locked tokens are released.

**burn & mint bridging**

as its name suggests, with burn and mint, tokens are burnt (destroyed) on the source chain, and equivalent native tokens are minted on the destination chain. it is popular for one-way token bridging because it removes the source tokens from circulation.

**liquidity pool bridging**

with liquidity pool bridging, a token that exists on multiple blockchains is deposited into a large multi-chain digital pool of liquidity. this liquidity pool allows users to swap the token between supported blockchains easily, and liquidity providers earn a small fee every time a user bridges tokens. this approach eliminates the need for complex minting or burning processes, as tokens are exchanged directly in the liquidity pool.

**atomic swap bridging**

in atomic swap bridging, users swap assets on the source chain for assets on the destination chain. two users agree on the token swap terms, such as the amount and blockchain networks involved. to ensure the security of the transaction, hash time-locked contracts (htlcs) are used to ensure it takes place simultaneously on both chains or not at all

# why interoperability in web3 matters

blockchains are like isolated islands, each with its unique ecosystem, but with limited interaction. the isolation of blockchains creates a massive problem for the end user, which bridges help solve by transferring information and assets, essentially unifying these islands. 

as blockchain and web3 grow, so too will the importance of interoperability.

**the need for cross-chain asset transfer**

for many top dapps and tokens, a multi-chain strategy is essential to stay competitive and maximize profits, avoiding the limitations of running on a single, isolated chain. smaller tokens and dapps also benefit by increasing trading volume through listings on multiple dexs across different chains.

from a token holder’s perspective, cross-chain asset transfers allow access to diverse opportunities, such as lower fees or unique features.

# key benefits of cross-chain bridges

there are many different benefits to using cross-chain bridges, both for dapps and tokenized web3 projects, as well as for token holders. for dapps, cross-chain bridges can help grow their ecosystem. bridging tokens can increase their trading volume and liquidity by getting listed on several dexs. 

token holders, on the other hand, can benefit from a better user experience and easier access to assets.

# challenges and risks

the greatest risk with cross-chain bridges is their security. as the popularity of cross-chain bridges continues to grow, so does the risk of attacks. hackers are constantly seeking vulnerabilities in these protocols, making it essential to stay secure.

most hacks occurred due to flaws in smart contracts. other hacks occurred due to insufficient validation schemes, social engineering, and, as we’ve seen with harmony horizon bridge, private key compromises.",https://www.reddit.com/r/CryptoCurrency/comments/1n0obj9/how_crosschain_bridges_work/,4,8,1n0obj9,reddit,CryptoCurrency,btc,en,0.9983,110381.4311249358,110075.92977628054,109968.72832112112,50.537328138842085,54.40408364227915,15.088211857005497,39.31587178527365
2025-08-26 15:13:11,bitcoin q2 dip similarities 'uncanny' as coinbase premium flips green,https://cointelegraph.com/news/bitcoin-q2-dip-similarities-uncanny-as-coinbase-premium-flips-green,5,6,1n0ojli,reddit,CryptoCurrency,btc,en,0.0,110321.60240541091,110077.53868472241,109975.06307520889,51.70556308578257,65.78703955166566,25.22797739593753,40.55906215572813
2025-08-26 15:43:32,"sold my 1 btc i just sold my 1 bitcoin to buy back later. i remember bought it when it was 13k when i was working at a min wage job. 
i have a weird feeling for selling it",https://www.reddit.com/r/Bitcoin/comments/1n0pcuf/sold_my_1_btc/,0,34,1n0pcuf,reddit,Bitcoin,btc,en,-0.0516,109719.04204452343,110049.01957511992,109978.22197407564,50.472959504933634,25.888106822400005,25.360003281230025,0.5281035411699797
2025-08-26 16:35:48,does anybody recommend the ton wallet? hello. i have some crypto saved in fidelity crypto but i don't have an actual crypto wallet used to spend crypto. i have telegram and telegram has a ton wallet and i was wondering if anybody has used it or like it? can you get btc with it?,https://www.reddit.com/r/Bitcoin/comments/1n0qqbh/does_anybody_recommend_the_ton_wallet/,4,7,1n0qqbh,reddit,Bitcoin,btc,en,0.7536,109662.1243937483,110029.92906524865,109979.16892117409,49.35379760016323,-10.207201295954292,18.246562365793164,-28.453763661747455
2025-08-26 16:43:16,bitcoin armory mirror needed hey all i had invested in bitcoin back in the day and the restore key is in the 16 line 5 numerical digits. which is one of armory’s oldest backs before they were encrypted with the new 8-21 word phrase. if anyone has information about this i would greatly appreciate the help!,https://www.reddit.com/r/Bitcoin/comments/1n0qxi8/bitcoin_armory_mirror_needed/,3,1,1n0qxi8,reddit,Bitcoin,btc,en,0.8047,109811.96002340046,110011.30903287065,109986.55435203442,52.6545209122167,-26.417979920166545,9.313653908601221,-35.73163382876777
2025-08-26 16:44:39,"grok’s btc vs. usd video game analogy 🤯 i thought this was cool so i thought i would share. my prompt was based on some buttcoiner saying btc was “fake internet money”. :

imagine you’re playing a massive online multiplayer game where the in-game currency is used to buy everything—from virtual houses to weapons. critics of bitcoin often dismiss it as “fake internet money” because it’s digital, not backed by physical assets like gold, and created through complex computer processes (mining) rather than a central authority. but here’s an analogy that flips the script: **the us dollar (usd) is essentially the same kind of “fake internet money,” except it’s controlled by a single player with cheat codes, while bitcoin has built-in rules limiting how much can ever exist.**
picture the federal reserve (the fed) as the game’s all-powerful admin. when banks need more money to lend out (like when the economy slows down), the fed doesn’t dig it up from some vault or mine it from the earth—it just types a few commands into their digital ledger and poof, new bank reserves appear out of thin air. this is called quantitative easing or open market operations. it’s like the admin spawning unlimited gold coins in the game whenever players complain they’re broke. those reserves then multiply through fractional reserve banking, where banks lend out way more than they actually hold, creating even more digital dollars in the system. there’s no hard cap; the supply can inflate endlessly based on the fed’s decisions, which can lead to devaluation (inflation) if they overdo it. sure, it’s “real” money because the government says so and enforces its use through laws and taxes, but at its core, it’s just entries in a computerized database—no different from pixels on a screen.
now, contrast that with bitcoin: it’s like a game where the developers hardcoded a strict limit of 21 million coins ever, enforced by math and a decentralized network of players (miners) who all agree on the rules. no single admin can cheat and spawn more; you have to “earn” it by solving cryptographic puzzles, which gets harder over time. critics call bitcoin “fake” because it’s intangible and volatile, but it has scarcity baked in, making it more like digital gold than the fed’s infinite-print button.
in the end, both are “fake” in the sense that they’re human inventions relying on collective belief and technology to hold value. but if bitcoin is fake internet money, the usd is fake government internet money—with the added risk that the printer never runs out of ink. this analogy highlights why some bitcoin advocates argue it’s a hedge against fiat currencies like the usd, which can be debased at will.",https://www.reddit.com/r/Bitcoin/comments/1n0qyw4/groks_btc_vs_usd_video_game_analogy/,0,1,1n0qyw4,reddit,Bitcoin,btc,en,-0.7473,109811.96002340046,109990.28707263285,109993.93978289477,52.93001831473493,-38.8176728032995,-0.3126114337789234,-38.505061369520575
2025-08-26 16:48:10,"alt season 2025 what are your expectation for this altseason? 
so far i have seen mainly a bitcoin bullrun during this cycle. alts pumped last year november to january but after that they were bleeding for the majority of 2025. most likely in september further bleeding will be happening. as from my point of view we will have one last pump during november/december before the final downtrend will start.
btc and eth and maybe another handfull ls has achieved new ath. but other than that it was very disappointing cycle i have to say. 
what are your strategies for the next months? 
when do you expect the top for alts to come? 
how long will a proper alt season last?",https://www.reddit.com/r/CryptoMarkets/comments/1n0r2b6/alt_season_2025/,30,49,1n0r2b6,reddit,CryptoMarkets,btc,en,-0.6704,109830.69831465706,109963.878232858,109989.16004427397,53.490648105265144,-46.59537279322103,-9.569163705667346,-37.02620908755368
2025-08-26 16:53:14,"btc to $1m is faster than you think yes, i said it! ignore all the short term price action, unless you are a trader, is mostly price manipulation. institutions and goverments are loading up, just follow the the money....soon you can buy a house with just 1 btc",https://www.reddit.com/r/Bitcoin/comments/1n0r7ac/btc_to_1m_is_faster_than_you_think/,135,56,1n0r7ac,reddit,Bitcoin,btc,en,-0.3164,109769.20099200186,109939.75709484397,109994.75888893969,36.64805217604561,-57.06378031572967,-19.068087027679812,-37.995693288049864
2025-08-26 17:00:35,future of bitcoin in finance with maestro - youtube podcast,https://www.youtube.com/watch?v=3KWOYHJZlnw,1,5,1n0reko,reddit,CryptoMarkets,btc,en,0.0,109881.034253352,109948.85066837011,110004.72757824778,42.48815475504505,-55.694052764811204,-26.393280175106092,-29.30077258970511
2025-08-26 17:19:19,bbusdt i feel bitcoin is gonna pop starting the alt season. btc dominance to hit 54%. got a long position on bbusdt. any thoughts?,https://www.reddit.com/r/CryptoMarkets/comments/1n0rxe3/bbusdt/,0,1,1n0rxe3,reddit,CryptoMarkets,btc,en,0.2023,109852.22185568292,109956.96669877204,110011.62424554984,41.81957609324589,-56.2846392240026,-32.3715519848854,-23.913087239117203
2025-08-26 17:24:58,"long-term network security incentives i have been following bitcoin for a while now, but i still have one issue that i can't seem to drop. the crux of my issue is: what happens when bitcoin's price is no longer able to double at the halving?   
  
luckily, we have been fortunate to not experience this yet, but in the scenario where this happens, bitcoin miners profits will decline immediately, which will cause less liquid miners to shut down. this would directly affect the security of the network. now, at this point the block difficulty would adjust, so mining would be cheaper, which would in turn cause more mining again and the cycle repeats. 

this is where transaction fees come in. basically, in the scenario that bitcoin's reward is too low, fees are supposed to incentivize miners to keep mining. but how are fees supposed to incentivize miners if block rewards are decreasing at a rate greater than transaction fees are growing?  
  
i'm specifically referring to price\*block reward too, so 3.125\*110000= $343,750 total reward per block. this means that the compensation per block must not go below this number without suffering losses in hash rate... right?",https://www.reddit.com/r/Bitcoin/comments/1n0s317/longterm_network_security_incentives/,2,9,1n0s317,reddit,Bitcoin,btc,en,0.9831,109881.56191396229,109966.54973208797,110021.33343765793,46.61046974432115,-53.765411553235026,-36.65032389855533,-17.115087654679698
2025-08-26 17:38:37,"bitcoin is dead… again every time the news says *“bitcoin is finished”*, i check the chart and it’s literally just taking a power nap like:

📉 *2025 dip: “i’m dying guys.”*  
📈 *2026 pump: “just kidding, gimme your house mortgage.”*

at this point bitcoin has “died” more times than a marvel character, and still comes back with a sequel nobody asked for.",https://i.redd.it/sf660247helf1.jpeg,304,68,1n0sg4v,reddit,Bitcoin,btc,en,0.7152,109781.42682970222,109971.72433781943,110019.18443183256,46.18047532238536,-59.166930366904126,-41.153645192225085,-18.01328517467904
2025-08-26 17:47:07,"trying to figure out what comes next after some unexpected gains this cycle has been wild — i started with what i thought was just “extra” savings, and it’s grown into way more than i ever pictured. honestly, it feels a little unreal to see the numbers now.

but it’s also left me with a big question: what’s the smartest move when things cool down? do people usually cash out into real-world assets, roll it back into btc/eth, or keep going deeper into alts?

i’m not trying to flex — more just surprised at how quickly things escalated and trying to learn from those who’ve been here before. if you’ve had success in past cycles, how did you handle it? did you protect your gains, or did you double down?

would love to hear both good and bad experiences — what worked, what didn’t, and what you’d do differently.",https://www.reddit.com/r/CryptoMarkets/comments/1n0soip/trying_to_figure_out_what_comes_next_after_some/,15,19,1n0soip,reddit,CryptoMarkets,btc,en,0.9876,109635.77051062732,109970.00004007018,110012.24744260691,27.135295800672182,-74.34393004322192,-47.79170216242446,-26.55222788079746
2025-08-26 17:55:40,this bitcoin miner uses just 24w,https://youtu.be/lmcj8sOW6Rk,11,4,1n0swp8,reddit,Bitcoin,btc,en,0.0,109782.674559985,109946.85044669625,110013.4103030689,34.10380812914994,-73.66867593723873,-52.967096917387316,-20.701579019851415
2025-08-26 18:37:48,strategy is the #1 performing large-cap u.s. stock since adopting the bitcoin standard.,https://i.redd.it/bthsd7muqelf1.jpeg,31,5,1n0u0uf,reddit,Bitcoin,btc,en,0.0,110484.93147876556,109963.50735044289,110025.88766746256,52.337072731728234,-16.27960668153537,-45.62959887021693,29.34999218868156
2025-08-26 18:46:22,"bitcoin in 2026? so while upon my research, people from all over the world are divided into 2 groups

the first one thinks bitcoin is going to pump to 200k in 2026

the second one thinks bitcoins is going to dip to 60k in 2026

what do you guys think?
all tips advice and opinion are welcomed",https://www.reddit.com/r/Bitcoin/comments/1n0u8uq/bitcoin_in_2026/,0,51,1n0u8uq,reddit,Bitcoin,btc,en,0.4137,110902.76006030914,110001.05568326669,110045.54481953617,61.29638955167963,62.19991683772241,-24.063695728629064,86.26361256635147
2025-08-26 18:47:40,bitcoin in 2026?,/r/Bitcoin/comments/1n0u8uq/bitcoin_in_2026/,2,1,1n0ua21,reddit,CryptoMarkets,btc,en,0.0,110902.76006030914,110046.33382867556,110063.54586371157,80.04733270022129,122.97789205265872,5.34462182762849,117.63327022503023
2025-08-26 18:58:36,"trying to locate a long lost youtuber i put question mark because maybe he's still active. and i'd imagine has discussed bitcoin.

there was a youtuber going back 10-15+ years ago who fit the following profile:

1. white male, seemed to be in 30s or 40s as of 2008-2012 period; guessing is in his 50s now
2. said he was former high-level investment banker, patrick bateman-like schtick at that time (he showed old footage from his banker days)
3. new look was surfer dude, with longish hair, maybe reddish in color. had large teeth reminiscent of gary busey, but not nearly as odd looking of a guy. many of his videos were shot in black and white from what i recall.
4. financial commentator, somewhat of the zero hedge mold; i recall a lot of bearish content, and discussion about 'burn rate' and reducing expenses
5. his channel or handle may have contained the letter x, though may be remembering wrong
6. he moved from mainland us to hawaii and built a home in the jungle there, which may have been an off-grid home

was seeing if any of his old content is still online.",https://www.reddit.com/r/Bitcoin/comments/1n0uk92/trying_to_locate_a_long_lost_youtuber/,3,3,1n0uk92,reddit,Bitcoin,btc,en,-0.1918,110753.61395335088,110088.36728652513,110076.18900979987,76.46697424840411,157.29681120101304,35.7350597023054,121.56175149870765
2025-08-26 18:58:45,ceo of coinbase asset management says bitcoin and crypto markets could explode in ‘south sea bubble’-style move – here’s his forecast,https://dailyhodl.com/2025/08/26/ceo-of-coinbase-asset-management-says-bitcoin-and-crypto-markets-could-explode-in-south-sea-bubble-style-price-swings-heres-his-forecast/,9,5,1n0ukde,reddit,CryptoCurrency,btc,en,0.3612,110753.61395335088,110110.61285495164,110089.0751765137,74.62293026763072,182.3922970158019,65.06650716500471,117.32578985079718
2025-08-26 19:07:21,a bar chart race showing bitcoin's market cap dominance over the last decade. i created this data visualization to track the market cap race over the last 10+ years. it shows bitcoin's staying power and how it has weathered every market cycle compared to thousands of other projects. i actually had to make it focus on the runner ups until the end as bitcoins dominance made the animation less visually interesting. at the end of the video it scales up to show the full picture with bitcoin.,https://www.youtube.com/watch?v=xPeKB4MhvBo,4,0,1n0uslr,reddit,Bitcoin,btc,en,0.7203,110680.07890243208,110130.02338269539,110100.33715740239,71.85944800223737,194.10941378294956,90.87508848859369,103.23432529435587
2025-08-26 19:08:59,bitcoin is working.,https://i.redd.it/sh3auf8cxelf1.jpeg,106,6,1n0uu43,reddit,Bitcoin,btc,en,0.0,110553.16526296876,110138.61008959703,110106.60435890665,67.2520456406807,190.95325295921066,110.89072138271709,80.06253157649357
2025-08-26 19:12:24,exec ord 6102 was signed on apr 5 1933 the same year a theorem central to btc was proven. satoshi's bday is apr 5. the fed's inept actions helped worsen the great depression instead of dampening the business cycle. a common motif in this work is a rat on a cycle...,https://i.redd.it/xpycsjhxxelf1.jpeg,50,0,1n0uxdr,reddit,Bitcoin,btc,en,-0.4404,110566.73051647302,110150.86649515014,110113.14286548099,69.49066689981368,187.386500422901,126.18987719075389,61.19662323214712
2025-08-26 19:35:05,"almost a whole coiner — 0.95 btc! what now? finally close to hitting that 1 btc milestone since 2018 when i had only 200$ — im sitting at 0.95 right now.

here’s my dilemma:
	•	i know the long-term play is never sell.
	•	still, i keep thinking about trimming a tiny % when things hit bubble territory (like the rainbow chart says).
	•	but my real goal: turn this into retirement without selling.

for those ahead of me on the journey:
👉 how do you make btc work for you without selling? loans? yield strategies? just wait until hyperbitcoinization?

would love to hear from ogs — how long until this stack can realistically make me work-free?",https://www.reddit.com/r/Bitcoin/comments/1n0viox/almost_a_whole_coiner_095_btc_what_now/,129,58,1n0viox,reddit,Bitcoin,btc,en,0.8556,111110.11801666029,110220.420293757,110132.6858049309,74.80511017347433,225.80372850285494,146.1126474531741,79.69108104968083
2025-08-26 19:47:09,"bitcoin security vs nano security : transaction confirmation speed and irreversibility let's dive into one of the key differences between btc and xno (nano): 

how quickly and irreversibly transactions confirm.

bitcoin :
confirmations are *probabilistic*. each block adds security, but it's not instant. 

for high confidence (say, 6 confirmations to avoid double-spends), you're looking at ~1 hour on average (blocks every ~10 mins). it's secure but slow, not ideal for quick coffee buys.

reversals are possible in theory via chain reorgs, though rare in bitcoin but happening now in other pow chains 

nano

*deterministic* finality. using a block-lattice and open representative voting (orv), transactions confirm under 1 second! 

once voted on by reps, it's irreversible. no mining, no fees, feeless and eco-friendly. perfect for microtransactions or daily use.",https://www.reddit.com/r/CryptoCurrency/comments/1n0vtyh/bitcoin_security_vs_nano_security_transaction/,0,7,1n0vtyh,reddit,CryptoCurrency,btc,en,0.4172,110935.5190518804,110284.09002666359,110151.08163595853,70.64785968268697,239.40131196196307,164.77038035493192,74.63093160703116
2025-08-26 20:25:27,"to those selling, you are cowards bitcoin isn’t dead and there isn’t any more bitcoin winters. 

the us government is in. blackrock is in. there is no incentive from any or these big players to let btc drop. they can hedge against the downside, but they cannot stop the upside.

mstr alone is buying up more btc than is mined. exchanges are at historic lows. plus the big print incoming… 

supply shock is inevitable.

if you sell now during the time of the year that is typically a low period… you’re a moron. hodl. if you don’t have conviction in bitcoin rn, then you don’t truly understand what it is you’re holding (and that’s okay). go study… get off btc reddit and go read. listen to podcasts. cram as much information as you can into your brain in the shortest time frame… this is how you win.

recommended reading: 
- the big print (lawrence lepard)
- the price of tomorrow (jeff booth)
- british hodl’s free bitcoin course (not a book but it’s very good, and free on his website)",https://www.reddit.com/r/Bitcoin/comments/1n0wunp/to_those_selling_you_are_cowards/,23,25,1n0wunp,reddit,Bitcoin,btc,en,0.8799,111218.0826657403,110354.39615878058,110174.64837873749,73.23179028472507,269.8671563821408,185.78973556037369,84.07742082176713
2025-08-26 20:26:02,btc are recovering recently what do you think of them?,https://www.reddit.com/r/Bitcoin/comments/1n0wv85/btc_are_recovering_recently/,1,0,1n0wv85,reddit,Bitcoin,btc,en,0.0,111218.0826657403,110424.70229089758,110198.03305095546,75.87304792417311,290.66099851895706,206.76398815209035,83.89701036686671
