timestamp,text,url,score,num_comments,id,source,subreddit
2025-08-17 11:38:21+00:00,"'using ace that test learning techniques to try to pass bitcoin courses? dear readers,

  
i wrote this previous post i could link \[[what would be the best type or learning (factual knowledge) for this type of course - what was centred on reading articles ? : r/bitcoin](https://www.reddit.com/r/bitcoin/comments/1mq4l2s/what_would_be_the_best_type_or_learning_factual/)\] where a basically said - that i felt like i had problem implementing type learning technique - to be able to learn the answers to past the test.

  
about maybe two months ago- i tried to read a type book called 'ace that test' - which i just today - it actually has no type of official book summary up to date on the internet? so maybe i should make one?

'apart from myles aka python programmer trying to endorse the book?

  
from the contents the 3rd part of the book 'study strategies that work - is all about actual learning method.

  
retrieval practice,

  
page 64 reads

  
quote

""

  
'its really flexible , different ways

  
1 write it out -  blank sheet, write / sketch everything from your memory , not word to word, put info in your own words, come with own examples or connections

  
2 practice tests or quizzes - (well there already is a type of practice part on plan b network

  
3 flash cards - retrieve answer before slipping over

  
4 concept maps from memory 

  
5 studying from groups - made me think is there some kind of bitcoin discord discussion maybe,

""

end quote

  
[ace that test: a student's guide to learning better — the learning scientists](https://www.learningscientists.org/ace-that-test-a-students-guide-to-learning-better)

  
hearing 

i spent about 10mins on this 

feel as if not best now to try te attempt the plan b first course,",https://www.reddit.com/r/Bitcoin/comments/1msomn9/using_ace_that_test_learning_techniques_to_try_to/,0,0,1msomn9,reddit,Bitcoin
2025-08-17 11:24:22+00:00,"swan in ny i was looking at potentially signing up for swan in ny since we're limited on where we can buy. i'm not so happy with coinbase for the fees. it seems like you can't withdraw bitcoin yet into a wallet (but you can withdraw in usd if needed) pending regulatory approval. any idea how long this approval takes? is this a reason not to use them? i know nyknyc and that. however, the fees seem to be the best.",https://www.reddit.com/r/Bitcoin/comments/1msodkg/swan_in_ny/,2,4,1msodkg,reddit,Bitcoin
2025-08-17 07:49:14+00:00,"taiwan’s top win international to rebrand to 'asiastrategy', pioneer bitcoin treasury strategy",https://ecency.com/hive-167922/@uyobong/taiwans-top-win-international-to-rebrand-to-asiastrategy-pioneer-bitcoin-treasury-strategy-jck,39,0,1mskwgs,reddit,Bitcoin
2025-08-17 07:22:54+00:00,"borrow against stocks to buy bitcoin most of my portfolio is in a widely diversified etf. i don't want to sell it to buy bitcoin, so i thought of borrowing against it (30% of the value of my portfolio) to buy btc with that money. annual interest ist 6,40%. the risk is should my portfolio (msci world) go down -70%, i would get liquidated. the merit compared to a consumer credit is that there are no monthly payments and i could theoretically let it run as long as i want, even decades and theoretically die with it (as long as my stock portfolio doesn't go down below the value of what i borrowed, but that would mean that the stock market of all industrial nations together dumps 70%. anybody doing something similar, or did you sell your stocks for btc?",https://www.reddit.com/r/Bitcoin/comments/1mskh2j/borrow_against_stocks_to_buy_bitcoin/,26,18,1mskh2j,reddit,Bitcoin
2025-08-17 06:36:46+00:00,"cryptorefill prepaid visa gift card legit? i'm trying to buy a prepaid visa gift card using btc, and bitrefill doesn't have any of them. i know that cryptorefill isn't so safe, but they are the only one that have visa cards. is it okay to buy?",https://www.reddit.com/r/Bitcoin/comments/1msjph9/cryptorefill_prepaid_visa_gift_card_legit/,0,5,1msjph9,reddit,Bitcoin
2025-08-17 06:25:45+00:00,bitcoin references in the new film eddington (2025)  i noticed bitcoin being mentioned multiple times (about 2–3 times throughout the film). i grabbed a couple of screenshots to share here,https://i.redd.it/t4ja7gwywijf1.jpeg,143,37,1msjinf,reddit,Bitcoin
2025-08-17 06:05:44+00:00,"daily discussion, august 17, 2025 please utilize this sticky thread for all general **bitcoin** discussions! if you see posts on the front page or /r/bitcoin/new which are better suited for this daily discussion thread, please help out by directing the op to this thread instead. thank you!

if you don't get an answer to your question, you can try phrasing it differently or commenting again tomorrow.

please check the [previous discussion thread](https://www.reddit.com/r/bitcoin/comments/1mrmhpa/daily_discussion_august_16_2025/) for unanswered questions.",https://www.reddit.com/r/Bitcoin/comments/1msj6ca/daily_discussion_august_17_2025/,42,34,1msj6ca,reddit,Bitcoin
2025-08-17 04:21:16+00:00,"the value investor's case for bitcoin this is a pretty differentiated argument that i hadn’t really seen elsewhere, so you might enjoy reading it if you haven’t seen it before.",https://finance.yahoo.com/community/post/9b6b70b7-1714-4eb0-89c0-a19d39bb44e4/,8,0,1mshbud,reddit,Bitcoin
2025-08-17 04:02:32+00:00,"i just love btc! every day, i scroll through reddit and see folks hyping their fave altcoin like it’s blasting off to jupiter. ‘this altcoin’s gonna 100x!’ ‘it’s the future, bro!’ same hype, different chain. meanwhile, bitcoin’s just lounging, sipping an espresso, outshining every ‘moon-bound’ token. i’ve survived three altcoin pumps, two rug pulls, and one ‘revolutionary defi project’ that ghosted faster than my ex’s texts. bitcoin? still king 👑 , still winning. can we stop pretending altcoin69’s gonna buy us a yacht? #bitcoingang #hodl",https://www.reddit.com/r/Bitcoin/comments/1msgzin/i_just_love_btc/,57,13,1msgzin,reddit,Bitcoin
2025-08-17 03:21:14+00:00,"i thought some people might get a kick out of this story… about ten years ago i started a coin base account and bought some btc. 
i didn’t make any money and gave up on it. 
fast forward i keep getting emails saying i’m gonna lose my account and my earnings are up. i ask myself “earnings?” 
so i go through the hassle of figuring out how to login (it wasn’t too bad but i had to upload my drivers license again).
two days later after a manual approval of my license, i’m able to login. i’m hoping there’s a couple hundred bucks but i don’t want to get my hopes up. 
i get logged in and it says my btc balance is $60,000. 
i kept thinking it must be wrong so i screenshot it and sent it to a friend and he says he thinks it’s pretty clear.
so today i went from being broke to having over .5 btc.",https://www.reddit.com/r/Bitcoin/comments/1msg7d1/i_thought_some_people_might_get_a_kick_out_of/,1276,251,1msg7d1,reddit,Bitcoin
2025-08-17 02:58:55+00:00,"what other technology will replace the seed phrase and risk losing everything? i believe in bitcoin but to be honest the amount of people that are not tech savvy will never ever use something that requires seed phrase and the risk of losing everything if they forget their seed phrase.  

i know it’s not complicated but the vast majority of people i speak with don’t buy crypto because of the confusing part of wallets",https://www.reddit.com/r/Bitcoin/comments/1msfrih/what_other_technology_will_replace_the_seed/,1,49,1msfrih,reddit,Bitcoin
2025-08-17 02:35:24+00:00,"where can i find solid sources about bitcoin for a college level essay? hey all - i’ve lurked this sub for quite a while and never posted. i’ve been holding bitcoin for a few years now and have a solid understanding of crypto/blockchains etc. i have been tasked to write a persuasive essay for my writing class and i want to argue that bitcoin is a great investment to fight against inflation, however i am having trouble finding good sources. there’s a million sources on the web but i need strong reliable sources (sources that pass the craap test) in order to actually use them in the essay. forums/overly biased and outdated sources aren’t much help to me. if anyone has any recommendations it would be greatly appreciated! thanks",https://www.reddit.com/r/Bitcoin/comments/1msfb4n/where_can_i_find_solid_sources_about_bitcoin_for/,9,10,1msfb4n,reddit,Bitcoin
2025-08-17 01:15:22+00:00,"of the fatal inconsistencies in saifedean ammous' bitcoin standard # of the fatal inconsistencies in saifedean ammous' bitcoin standard

(https://x.com/soaker\_patoshi)

in the previous essay ([bitcoin most certainly violates mises regression theorem and this fact compels clarification or re‐solution from the mises institute; and an introduction to szabonian deconstruction](https://www.reddit.com/r/bitcoin/comments/1mrl65c/bitcoin_most_certainly_violates_mises_regression/)) we ended with statements by mises that his (austrian) school of thought ""praxeology"" rejects empirical (think archeological) based arguments and only accepts arguments extended from reason. 

here we will show countless examples of saifedean ammous, a purported austrian economics professor relying on empirical based points and arguments trying to make his conclusion about the economic implications of bitcoin. 

in this essay i use the perspective and intention of szabonian deconstruction, as well as our insights from doing the same with mises regression theorem, to highlight saifedean ammous’ nefarious use and wrapping of academic scholars work notably including mises, hayek, and nash as well as implicitly szabo and satoshi.  
  
further i highlight that saifedean's account of how money originated and how moneyness originates in objects is based on an anthropologically inconsistent argument with reference to jo walton, “the analogy between bitcoin and yapese stone money is based on proposed commonalities that are inaccurate, ill-defined, and/or trivial.“  
  
this essay then gives an example of how nefarious constructions can be ‘un-wrapped’ using szabonian deconstruction (properly framed inquiries) and it lays the beginning of my attempt to usefully frame an inquiry into the historical and cultural evolution of objects humanity has used as money as and money-like things (ie such proto-money, credit, wealth storage etc.).  
  
[https://github.com/jaltoorey/idealmoney/wiki/of-the-fatal-inconsistencies-in-saifedean-ammous'-bitcoin-standard](https://t.co/wx1it5qycr)",https://www.youtube.com/watch?v=Oyj25tQYJck,1,0,1msdp1e,reddit,Bitcoin
2025-08-16 23:10:52+00:00,"bitcoin loan rollover vs. sell-off simulator (google sheets) — feedback welcome i put together a btc simulator sheet that compares two strategies.

loan rollover → borrow against btc with adjustable loan terms, rolling each year.

sell strategy → see what happens if you just sell btc annually instead.

it has adjustable inputs (ltv, interest, btc growth, expenses), models (stock-to-flow, powerlaw), and charts for debt, collateral, and btc balance over time.

🔗 link:

[https://docs.google.com/spreadsheets/d/e/2pacx-1vqnugq60ux4bvl3n6g7lkypaojlpcfowlemtgea2vwlu6bhlbu3whk9\_z9msbjamvpymtbg8fkapgrr/pub?output=xlsx](https://docs.google.com/spreadsheets/d/e/2pacx-1vqnugq60ux4bvl3n6g7lkypaojlpcfowlemtgea2vwlu6bhlbu3whk9_z9msbjamvpymtbg8fkapgrr/pub?output=xlsx)

looking for feedback or mistakes. 

feel free to copy, tweak, or profit from it. the goal is to keep people informed and hodling.",https://www.reddit.com/gallery/1msaxt2,41,22,1msaxt2,reddit,Bitcoin
2025-08-16 22:15:14+00:00,bitcoin mining in space: the craziest or smartest idea ever?,https://youtu.be/IY3vwr-fKuI?feature=shared,0,9,1ms9k2a,reddit,Bitcoin
2025-08-16 21:11:30+00:00,"nocoiners know something isn't right, just hate the solution when bitcoin is mentioned these days, i just mention lyn alden's broken money book and let the curious ones to find the solution for themselves.",https://i.redd.it/ogo9o1z26gjf1.png,198,26,1ms7wag,reddit,Bitcoin
2025-08-16 19:53:08+00:00,"buy #bitcoin 🐂 the 10‑year rolling cagr (compounded annual growth rate) for bitcoin using aug 16, 2015 → aug 16, 2025 is 84.4% per year. 

to put it into perspective the ndx is 17.8%",https://i.redd.it/02kxyek3sfjf1.jpeg,67,14,1ms5sl0,reddit,Bitcoin
2025-08-16 19:28:20+00:00,why bitcoin feels different this year than any other year? i feel the world is waking up and decided this year throw everything in bitcoin..,https://www.reddit.com/r/Bitcoin/comments/1ms54yo/why_bitcoin_feels_different_this_year_than_any/,58,61,1ms54yo,reddit,Bitcoin
2025-08-16 18:49:55+00:00,"how many people have over 0.1 btc? just estimate. ok. just throw a number and try to defend it somehow. just curious. obviously a wallet has many addresses and people can have multiple wallets. lots of btc is lost in forgotten drives.

so, say something. is it over 1m?

i am expecting to get an answer like that: **i think over 2 million people have over 0.1 btc, because... {put\_your\_reasons\_here}.**

**the idea is not to say how much you have, but to say how many people have over 0.1.**",https://www.reddit.com/r/Bitcoin/comments/1ms42el/how_many_people_have_over_01_btc_just_estimate/,349,201,1ms42el,reddit,Bitcoin
2025-08-16 18:48:08+00:00,"my daughter has been tracking btc price for 8 years and just added a new date to her chart i helped my daughter create a list in 2017 of all the things she may want over her life, their average cost and when one bitcoin would be worth the same so she could track it over time. only one more date to fill in.

so proud of her!",https://i.redd.it/r24ds58igfjf1.jpeg,0,16,1ms40nb,reddit,Bitcoin
2025-08-16 18:31:25+00:00,what if hal was right? $10m per btc doesn’t sound so crazy anymore,https://i.redd.it/w4og1fqidfjf1.jpeg,908,249,1ms3jut,reddit,Bitcoin
2025-08-16 18:22:50+00:00,"if selling your btc meant you could be work optional, would you do it? hypothetical. if selling meant you didn’t have to work if you didn’t want to, meant you could pursue another job that aligns more with your passions or spend more time with your family would you part with your stack?",https://www.reddit.com/r/Bitcoin/comments/1ms3bio/if_selling_your_btc_meant_you_could_be_work/,43,121,1ms3bio,reddit,Bitcoin
2025-08-16 18:04:20+00:00,"help transferring bitcoin & robinhood scam hey all. i do not want to dca on robinhood anymore with my daily purchases going into bitcoin. i am looking for help on which platform to use to purchase bitcoin, and how to transfer it to a wallet like trezor, however i am located in new york so i know a lot of apps won't let me use them (river for example). what is my best option to do this? thanks.",https://www.reddit.com/r/Bitcoin/comments/1ms2sq4/help_transferring_bitcoin_robinhood_scam/,0,16,1ms2sq4,reddit,Bitcoin
2025-08-16 17:31:47+00:00,"btchel conference 2025 - innovator partner highlights we were proud to join the **btchel conference 2025** as an innovator partner.  
here are a few snapshots from the main stage, sponsor wall, and our booth at the innovator exhibition.

bitcoin, security, and innovation – exactly where xellox belongs.

*what was your highlight of btchel 2025?*

[audience gathered at the btchel conference main stage, with the event logo projected on a large screen. ](https://preview.redd.it/fin8mgssijjf1.jpg?width=4624&format=pjpg&auto=webp&s=5a5bc38b666201ff8ae7b39b1fc27f3a17ac0aad)

[xellox booth at the btchel conference innovator exhibition, with a team member welcoming visitors.](https://preview.redd.it/5h1wd984jjjf1.jpg?width=3472&format=pjpg&auto=webp&s=37ce55aae409b9245e127b152065c59f51ce4413)

[sponsor recognition screen at the btchel conference showing partner logos, including xellox as an innovator partner.](https://preview.redd.it/3dqaubw8jjjf1.jpg?width=4624&format=pjpg&auto=webp&s=3d7e9a5873736a2a3554325a786e3d14e8be60c1)",https://www.reddit.com/r/Bitcoin/comments/1ms1vtc/btchel_conference_2025_innovator_partner/,2,1,1ms1vtc,reddit,Bitcoin
2025-08-16 17:27:04+00:00,"privacy in bitcoin position hello everyone,

i want to make sure i have my sats as private as possible, i've been reading a little and i think i understand how to do it.

but right now i have some btc in my cold wallet (keepkey) that i bought at the time through an exchange and transferred to my wallet and more recently through banxa with kyc.

from now on i plan to buy from bisq or mt pelerin without kyc and send it to another address associated with the same wallet.

my question is:

. is this a better option than buying from bisq or mt pelerin without kyc and simply sending to another address associated with my same wallet? some recomendations?

. what can i do with the sats that i have already purchased with kyc to anonymize them?",https://www.reddit.com/r/Bitcoin/comments/1ms1r5z/privacy_in_bitcoin_position/,2,1,1ms1r5z,reddit,Bitcoin
2025-08-16 17:20:09+00:00,"daily bitcoin meme until btc is at $200,000 #67",https://i.redd.it/js5sg6sr0fjf1.jpeg,651,19,1ms1ka5,reddit,Bitcoin
2025-08-16 16:57:55+00:00,s 954 - bitcoin act of 2025,https://www.opencongress.net/bill-details/41877,10,3,1ms0xuk,reddit,Bitcoin
2025-08-16 16:49:16+00:00,"a redbull fuelled breakdown of why i sleep better with my own keys. for those who saw my last post and now picture me as a redbull junkie with empty cans shaking for a third. it is not true but enjoy the thought as the real me is far less exciting. i drink it maybe twice a month when i feel like treating myself and sit out in my garden and drink it like it is some sort of rare vintage whilst i read the news thinking i look sophisticated enough to understand how the world actually works.

anyway, it's pretty much impossible to know exactly how many people keep their bitcoin on exchanges and i'm on about considerable amounts because i know some of you will say ""no point self custodying if you only have £25 and a dream"", but lets be honest if you think that kind of bag is your key to an early retirement then please, treat yourself to a cold wallet and maybe a tattoo on your forehead that reads ""tell me to buy more bitcoin"". on a serious note, how many of you actually read the t&c's when signing up to an exchange? i didn't, but there will also be things that say:

""we reserve the right to suspend withdrawals""

""insolvency may result in partial or total loss of funds""

""in the event of catastrophic failure, we'll send you an automated email with the word ""unfortunately"" and picture of us sipping cocktails funded by everyone who lost their money""

we all know things like this has happened before which is why i'm hoping to at least give one person a sign to finally getting around to ordering that hardware wallet. i also find it a lot easier to hold on to my sats as its a whole ""thing"" to actually get around to liquidating. i do definitely sleep better knowing i'm the only person who has access to my funds and in that worst case scenario, global meltdown, we only need one bitcoiner to keep his node running and we can send some to the local prepper who is selling beans out of his garage.

so if you've got a hardware wallet sat in your shopping basket (the manufactures website of course) then see this as your sign to buy it, just make sure your keys are somewhere secure because its very easy to go half arsed with it at first but when your bag grows and your security doesnt, you're playing with fire.

i hate to sound old but just be sensible and maybe have a redbull just before unboxing ;).

i was hoping to do a poll but it didnt seem to let me as i was quite interested to se what the results would be. i hope this post was entertaining but if not it just gave me something to do on my saturday afternoon. if anyone has any questions about self custody then please just ask.",https://www.reddit.com/r/Bitcoin/comments/1ms0p5y/a_redbull_fuelled_breakdown_of_why_i_sleep_better/,1,1,1ms0p5y,reddit,Bitcoin
2025-08-16 16:32:48+00:00,"if btc would reach 10million dollar, wouldn't that weaken  its ability for accurate pricing in daily life? currently, 1 sat is 0,1 cent. if btc goes to 1 million, 1 sat is exactly 1 cent. but if it reaches 10 million, one sat would be worth 10 cents and it couldn't be split in smaller parts anymore. wouldn't that limit btcs ability to be used for accurate pricing in daily life? a burger couldn't be $5,99 it would either have to be $5,90 or $6,00. 

what solution could be used for that scenario?",https://www.reddit.com/r/Bitcoin/comments/1ms08y2/if_btc_would_reach_10million_dollar_wouldnt_that/,0,37,1ms08y2,reddit,Bitcoin
2025-08-16 15:53:58+00:00,"my bags packed and i’m off back to fiat clown land. i’ve stacked from 2021 to now and i have 1.111btc are my bags packed ? 

have i done alright ? 

i can’t ever see me averaging more than $200 per month into bitcoin now due to my family and lifestyle. 

would 1.1btc be life changing in 10-15 years ? 

do i just have to sit on my ass now and forget about bitcoin surely it can’t be that easy ? 

what are people’s thoughts ? 

thanks.",https://www.reddit.com/r/Bitcoin/comments/1mrz5u6/my_bags_packed_and_im_off_back_to_fiat_clown_land/,0,39,1mrz5u6,reddit,Bitcoin
