timestamp,text,url,score,num_comments,id,source,subreddit
2025-08-14 12:19:10+00:00,bitcoin volatility over the last 15 years,https://i.redd.it/g2gjy8i89zif1.png,359,22,1mpz1n2,reddit,Bitcoin
2025-08-14 11:38:37+00:00,"zeitgeist (2007) if you wish to learn what is wrong with the current financial monetary system go watch it! i’m sure many old timers in here became fascinated with how corrupt the monetary system is based off this one documentary! 

if you haven’t, watch this and you’ll know why bitcoin is so important",https://www.reddit.com/r/Bitcoin/comments/1mpy5yb/zeitgeist_2007_if_you_wish_to_learn_what_is_wrong/,14,0,1mpy5yb,reddit,Bitcoin
2025-08-14 11:05:31+00:00,i love watching these anti bitcoin clips on days like today... reminds me how detached from reality they are,https://v.redd.it/gyobeca5wyif1,281,94,1mpxi39,reddit,Bitcoin
2025-08-14 10:00:53+00:00,"gifting bitcoin been making a decent amount with this latest run-up in the btc price. at work, i offered to gift a decent amount of btc to 8 people. a couple said, “sure, why not.”

the rest? they said no because it was “useless.”

i explained it was literal free money and the least they could do was hold it and check back years from now.

they still said they were fine… so i just left it alone.

some people will walk past an open treasure chest because they don’t believe in treasure.",https://www.reddit.com/r/Bitcoin/comments/1mpwbh5/gifting_bitcoin/,39,51,1mpwbh5,reddit,Bitcoin
2025-08-14 09:22:26+00:00,today btc broke its own record again. its outshining any other one,https://i.redd.it/isi1cn5qdyif1.jpeg,24,3,1mpvo5m,reddit,Bitcoin
2025-08-14 07:59:18+00:00,describe bitcoin with only 3 words waiting until 200k. what would you describe bitcoin with only 3 words?,https://www.reddit.com/r/Bitcoin/comments/1mpubdb/describe_bitcoin_with_only_3_words/,0,42,1mpubdb,reddit,Bitcoin
2025-08-14 07:42:42+00:00,"true price discovery starts at $1m per coin hear me out.  everyone here thinks bitcoin is superior to gold and i concur. therefore, given golds market cap in the world economy - bitcoin needs to reach gold parity (roughly $1m per coin) before it really is in any form of true price discovery.

in other words, i’ll start paying attention once we 9x from here.",https://www.reddit.com/r/Bitcoin/comments/1mpu1oo/true_price_discovery_starts_at_1m_per_coin/,0,1,1mpu1oo,reddit,Bitcoin
2025-08-14 07:10:57+00:00,"⚡ lightning thursday! august 14, 2025: explore the lightning network!⚡ the lightning network is a second-layer solution on top of the bitcoin blockchain that enables quick, cheap and scalable bitcoin payments.

here is the place to discuss and learn more about lightning!

ask your questions about lightning

provide reviews, feedback, comparisons of ln apps, services, websites etc

learn about new ln features, development, apps

link to good quality resources (articles, wikis etc)

resources:

* here is an awesome list of resources compiled by jameson lopp: https://www.lopp.net/lightning-information.html

* want to test out your lightning fire power? tip the bitcoin devs! https://bitcoindevlist.com/

* previous threads: [search](https://www.reddit.com/r/bitcoin/search?q=lightning+thursday&restrict_sr=on&include_over_18=on&sort=new&t=all)

* lnbook getting closer towards being finished and can already be seen at: https://github.com/lnbook/lnbook

* lightning dedicated youtube channel: https://youtube.com/renepickhardt

* also there is the playlist by chaincode labs: https://youtube.com/playlist?list=plplh33trght17_u3as2p3vhfagl8psooy

* lightning stores: https://www.lightningnetworkstores.com/

* learn more and talk about lightning right here in r/bitcoin, r/bitcoinbeginners, r/thelightningnetwork, and [the r/bitcoin chat](https://discord.gg/qe3rwbrnqh)",https://www.reddit.com/r/Bitcoin/comments/1mptiyb/lightning_thursday_august_14_2025_explore_the/,9,2,1mptiyb,reddit,Bitcoin
2025-08-14 07:00:49+00:00,i want btc to have a massive dip so i can buy more!,https://www.reddit.com/r/Bitcoin/comments/1mptcnp/i_want_btc_to_have_a_massive_dip/,0,17,1mptcnp,reddit,Bitcoin
2025-08-14 06:23:53+00:00,bitcoin will never reach $20 again…,https://i.redd.it/u7oktqdwhxif1.jpeg,528,75,1mpspll,reddit,Bitcoin
2025-08-14 06:07:13+00:00,it's crazy to think in the future bitcoin will be without a doubt the top asset of the world. when do you think it will dethrone gold?,https://www.reddit.com/r/Bitcoin/comments/1mpsf4u/its_crazy_to_think_in_the_future_bitcoin_will_be/,120,74,1mpsf4u,reddit,Bitcoin
2025-08-14 06:04:53+00:00,"daily discussion, august 14, 2025 please utilize this sticky thread for all general **bitcoin** discussions! if you see posts on the front page or /r/bitcoin/new which are better suited for this daily discussion thread, please help out by directing the op to this thread instead. thank you!

if you don't get an answer to your question, you can try phrasing it differently or commenting again tomorrow.

please check the [previous discussion thread](https://www.reddit.com/r/bitcoin/comments/1mowk1r/daily_discussion_august_13_2025/) for unanswered questions.",https://www.reddit.com/r/Bitcoin/comments/1mpsdn6/daily_discussion_august_14_2025/,38,192,1mpsdn6,reddit,Bitcoin
2025-08-14 05:57:47+00:00,fbtc - bitu strategy over the past 8 months i have created the etf equivalent of 2 additional bitcoin by selling fbtc and buying bitu on the dips and selling bitu and buying fbtc after large gains. this strategy leaves you with at least 100% exposure to bitcoin at all times and still allows you to play the swings and volatility.,https://www.reddit.com/r/Bitcoin/comments/1mps931/fbtc_bitu_strategy/,3,5,1mps931,reddit,Bitcoin
2025-08-14 05:42:12+00:00,"already gone, keep waiting $btc jumping past  $124k, setting a new all time high, and now became the 5th largest asset in the world.

to those waiting for below $100k, you might be waiting a long, long time, we have gone and this rocket is not coming back.",https://i.redd.it/5hgakhn79xif1.jpeg,108,8,1mprz1b,reddit,Bitcoin
2025-08-14 05:39:40+00:00,"is there a way i can buy bitcoin at 17? edit: i should also mention i'm in the usa if that helps.

i know nothing about bitcoin. other than that there's something i want to buy with it, but i'd prefer not to say what. i'm not going to invest it and sell it later on, i'm planning to spend it as soon as i'm able to, so i'm not worried about stocks or anything. i've read cashapp can get you to buy bitcoin, but there was a lot of terms under those threads i didn't understand at all and they were a few years old. does anyone have any recommendations? if yall recommend me to wait until 18, i will, it's only a few months away for me.",https://www.reddit.com/r/Bitcoin/comments/1mprxg2/is_there_a_way_i_can_buy_bitcoin_at_17/,3,17,1mprxg2,reddit,Bitcoin
2025-08-14 05:30:53+00:00,btc vs. world's weakest currency since we're celebrating another ath....,https://i.redd.it/7ruvtcyf8xif1.jpeg,98,26,1mprrsp,reddit,Bitcoin
2025-08-14 04:16:14+00:00,"monthly return here is a visualization to follow the btc monthly returns, with ytd per year, month averages and price on hover.

it's better to see it on a desktop

https://s3.us-east-1.amazonaws.com/will.btcanalytics/index.html",https://www.reddit.com/r/Bitcoin/comments/1mpqepp/monthly_return/,5,1,1mpqepp,reddit,Bitcoin
2025-08-14 02:45:01+00:00,🔥 now: bitcoin surpasses google in market cap🔥 making it the 5th largest asset in the world,https://i.redd.it/av0mamkuewif1.jpeg,243,26,1mpolng,reddit,Bitcoin
2025-08-14 02:43:56+00:00,the hidden happiness of bitcoin mining: a utilitarian revolution,https://www.youtube.com/watch?v=Il7rY-AfTXE&ab_channel=WisdomofBitcoin,2,1,1mpoksu,reddit,Bitcoin
2025-08-14 01:57:52+00:00,"living off bitcoin experiment: video people asked for me to make a video on living off bitcoin or how i am going about it. it is a ramble video. i will update with pros and cons, especially during the tax season. enjoy or don't, and keep stacking sats.",https://www.youtube.com/watch?v=zLYIvJr9fZ4,0,0,1mpnlmy,reddit,Bitcoin
2025-08-14 01:47:19+00:00,"people who have been involved in btc for multiple cycles please respond hey im just curious about the sentiment. ive been around since 2017 & i personally feel since institutions have been adopting it & even governmental bodies it feels different this time around. i dont really speak to many other bitcoiners because i dont speak abt bitcoin at all in my personal life so ide love to know from ppl who have held thru multiple cycles how does it feel this time around for you ? whats your observations ? in terms of how bitcoin is talked abt, discussed socially & the general sentiment surrounding it i have my own opinions and feelings but im curious about other perspectives tbh",https://www.reddit.com/r/Bitcoin/comments/1mpndf7/people_who_have_been_involved_in_btc_for_multiple/,3,24,1mpndf7,reddit,Bitcoin
2025-08-14 01:41:18+00:00,exchange recommendation i am trying to buy btc with prepaid visa card and withdraw to my hardware wallet. may i have your recommendation? thanks.,https://www.reddit.com/r/Bitcoin/comments/1mpn8ip/exchange_recommendation/,0,4,1mpn8ip,reddit,Bitcoin
2025-08-14 01:14:40+00:00,new bitcoin all time high of $170000 cad as it surpasses 124k usd today,https://i.redd.it/lsjcsy4fyvif1.png,75,12,1mpmnnw,reddit,Bitcoin
2025-08-14 01:00:18+00:00,"me, when my family asks when i plan to finally sell off my btc",https://i.redd.it/rggrbp66wvif1.gif,39,6,1mpmc1m,reddit,Bitcoin
2025-08-14 00:52:49+00:00,"gbtc etf vs btc have a question ? i have around 100 k invested in gbtc etf long term ,should i sell and buy btc instead ?",https://www.reddit.com/r/Bitcoin/comments/1mpm6a4/gbtc_etf_vs_btc/,1,7,1mpm6a4,reddit,Bitcoin
2025-08-14 00:35:42+00:00,assessing bitcoin and gold as safe havens amid global uncertainties: a rolling window dcc-garch analysis,https://worldandnewworld.com/bitcoin-as-safe-haven/,0,0,1mplsik,reddit,Bitcoin
2025-08-14 00:31:59+00:00,"i just bought bitcoin at all-time highs bitcoin to 1 milly please, thank you 🙏


one thing that sucks is i thought i'd be able to send btc from webull pay to my trezor, but they dont have a send/receive button unfortunately",https://i.redd.it/a6vu9o2vqvif1.png,1112,269,1mplpk7,reddit,Bitcoin
2025-08-14 00:11:03+00:00,"no losers anyone who has ever bought bitcoin, and held onto it, has not lost money.",https://www.reddit.com/r/Bitcoin/comments/1mpl8h2/no_losers/,7,3,1mpl8h2,reddit,Bitcoin
2025-08-14 00:07:36+00:00,"btc trading at 123,456 gonna be the only time we get sequential numbers on price until 234,567",https://www.reddit.com/gallery/1mpl5oe,49,9,1mpl5oe,reddit,Bitcoin
2025-08-14 00:07:29+00:00,"0,07279 btc but feels like i can still miss the train hey, i've been lately following more carefully the market - although i got my first bitcoin payment about an year ago from a client. 
now i can't help but think i need to have a certain amount that is both safe for my finances but still won't miss the train if btc will blow up. how much you think is enough to say that one day i could have money for early retirement?",https://www.reddit.com/r/Bitcoin/comments/1mpl5l6/007279_btc_but_feels_like_i_can_still_miss_the/,0,5,1mpl5l6,reddit,Bitcoin
