timestamp,text,url,score,num_comments,id,source,subreddit,coin,lang,sentiment
2025-08-26 20:34:40+00:00,"what's the best instant exchange to sell bitcoin i am mining bitcoin and want to hold as much as possible, but to keep my machines running i need to sell some. i do not like using p2p because it takes too long and i have had issues before. changenow froze one of my orders and that made me lose trust in the process.

i also do not trust centralized exchanges, so i avoid them completely. now that exch has shut down, i feel stuck without any reliable options left. is there any method that could help me sell without giving up control or going through all the hassle, something fast and secure that does not involve the usual problems i have faced?",https://www.reddit.com/r/Bitcoin/comments/1n0x3ix/whats_the_best_instant_exchange_to_sell_bitcoin/,1,0,1n0x3ix,reddit,Bitcoin,btc,en,0.1733
2025-08-26 20:26:02+00:00,btc are recovering recently what do you think of them?,https://www.reddit.com/r/Bitcoin/comments/1n0wv85/btc_are_recovering_recently/,1,0,1n0wv85,reddit,Bitcoin,btc,en,0.0
2025-08-26 20:25:27+00:00,"to those selling, you are cowards bitcoin isn’t dead and there isn’t any more bitcoin winters. 

the us government is in. blackrock is in. there is no incentive from any or these big players to let btc drop. they can hedge against the downside, but they cannot stop the upside.

mstr alone is buying up more btc than is mined. exchanges are at historic lows. plus the big print incoming… 

supply shock is inevitable.

if you sell now during the time of the year that is typically a low period… you’re a moron. hodl. if you don’t have conviction in bitcoin rn, then you don’t truly understand what it is you’re holding (and that’s okay). go study… get off btc reddit and go read. listen to podcasts. cram as much information as you can into your brain in the shortest time frame… this is how you win.

recommended reading: 
- the big print (lawrence lepard)
- the price of tomorrow (jeff booth)
- british hodl’s free bitcoin course (not a book but it’s very good, and free on his website)",https://www.reddit.com/r/Bitcoin/comments/1n0wunp/to_those_selling_you_are_cowards/,23,25,1n0wunp,reddit,Bitcoin,btc,en,0.8799
2025-08-26 18:37:48+00:00,strategy is the #1 performing large-cap u.s. stock since adopting the bitcoin standard.,https://i.redd.it/bthsd7muqelf1.jpeg,31,5,1n0u0uf,reddit,Bitcoin,btc,en,0.0
2025-08-26 19:35:05+00:00,"almost a whole coiner — 0.95 btc! what now? finally close to hitting that 1 btc milestone since 2018 when i had only 200$ — im sitting at 0.95 right now.

here’s my dilemma:
	•	i know the long-term play is never sell.
	•	still, i keep thinking about trimming a tiny % when things hit bubble territory (like the rainbow chart says).
	•	but my real goal: turn this into retirement without selling.

for those ahead of me on the journey:
👉 how do you make btc work for you without selling? loans? yield strategies? just wait until hyperbitcoinization?

would love to hear from ogs — how long until this stack can realistically make me work-free?",https://www.reddit.com/r/Bitcoin/comments/1n0viox/almost_a_whole_coiner_095_btc_what_now/,129,58,1n0viox,reddit,Bitcoin,btc,en,0.8556
2025-08-26 19:12:24+00:00,exec ord 6102 was signed on apr 5 1933 the same year a theorem central to btc was proven. satoshi's bday is apr 5. the fed's inept actions helped worsen the great depression instead of dampening the business cycle. a common motif in this work is a rat on a cycle...,https://i.redd.it/xpycsjhxxelf1.jpeg,50,0,1n0uxdr,reddit,Bitcoin,btc,en,-0.4404
2025-08-26 19:08:59+00:00,bitcoin is working.,https://i.redd.it/sh3auf8cxelf1.jpeg,106,6,1n0uu43,reddit,Bitcoin,btc,en,0.0
2025-08-26 19:07:21+00:00,a bar chart race showing bitcoin's market cap dominance over the last decade. i created this data visualization to track the market cap race over the last 10+ years. it shows bitcoin's staying power and how it has weathered every market cycle compared to thousands of other projects. i actually had to make it focus on the runner ups until the end as bitcoins dominance made the animation less visually interesting. at the end of the video it scales up to show the full picture with bitcoin.,https://www.youtube.com/watch?v=xPeKB4MhvBo,4,0,1n0uslr,reddit,Bitcoin,btc,en,0.7203
2025-08-26 18:58:36+00:00,"trying to locate a long lost youtuber i put question mark because maybe he's still active. and i'd imagine has discussed bitcoin.

there was a youtuber going back 10-15+ years ago who fit the following profile:

1. white male, seemed to be in 30s or 40s as of 2008-2012 period; guessing is in his 50s now
2. said he was former high-level investment banker, patrick bateman-like schtick at that time (he showed old footage from his banker days)
3. new look was surfer dude, with longish hair, maybe reddish in color. had large teeth reminiscent of gary busey, but not nearly as odd looking of a guy. many of his videos were shot in black and white from what i recall.
4. financial commentator, somewhat of the zero hedge mold; i recall a lot of bearish content, and discussion about 'burn rate' and reducing expenses
5. his channel or handle may have contained the letter x, though may be remembering wrong
6. he moved from mainland us to hawaii and built a home in the jungle there, which may have been an off-grid home

was seeing if any of his old content is still online.",https://www.reddit.com/r/Bitcoin/comments/1n0uk92/trying_to_locate_a_long_lost_youtuber/,3,3,1n0uk92,reddit,Bitcoin,btc,en,-0.1918
2025-08-26 18:46:22+00:00,"bitcoin in 2026? so while upon my research, people from all over the world are divided into 2 groups

the first one thinks bitcoin is going to pump to 200k in 2026

the second one thinks bitcoins is going to dip to 60k in 2026

what do you guys think?
all tips advice and opinion are welcomed",https://www.reddit.com/r/Bitcoin/comments/1n0u8uq/bitcoin_in_2026/,0,51,1n0u8uq,reddit,Bitcoin,btc,en,0.4137
2025-08-26 17:55:40+00:00,this bitcoin miner uses just 24w,https://youtu.be/lmcj8sOW6Rk,11,4,1n0swp8,reddit,Bitcoin,btc,en,0.0
2025-08-26 17:38:37+00:00,"bitcoin is dead… again every time the news says *“bitcoin is finished”*, i check the chart and it’s literally just taking a power nap like:

📉 *2025 dip: “i’m dying guys.”*  
📈 *2026 pump: “just kidding, gimme your house mortgage.”*

at this point bitcoin has “died” more times than a marvel character, and still comes back with a sequel nobody asked for.",https://i.redd.it/sf660247helf1.jpeg,304,68,1n0sg4v,reddit,Bitcoin,btc,en,0.7152
2025-08-26 17:24:58+00:00,"long-term network security incentives i have been following bitcoin for a while now, but i still have one issue that i can't seem to drop. the crux of my issue is: what happens when bitcoin's price is no longer able to double at the halving?   
  
luckily, we have been fortunate to not experience this yet, but in the scenario where this happens, bitcoin miners profits will decline immediately, which will cause less liquid miners to shut down. this would directly affect the security of the network. now, at this point the block difficulty would adjust, so mining would be cheaper, which would in turn cause more mining again and the cycle repeats. 

this is where transaction fees come in. basically, in the scenario that bitcoin's reward is too low, fees are supposed to incentivize miners to keep mining. but how are fees supposed to incentivize miners if block rewards are decreasing at a rate greater than transaction fees are growing?  
  
i'm specifically referring to price\*block reward too, so 3.125\*110000= $343,750 total reward per block. this means that the compensation per block must not go below this number without suffering losses in hash rate... right?",https://www.reddit.com/r/Bitcoin/comments/1n0s317/longterm_network_security_incentives/,2,9,1n0s317,reddit,Bitcoin,btc,en,0.9831
2025-08-26 16:53:14+00:00,"btc to $1m is faster than you think yes, i said it! ignore all the short term price action, unless you are a trader, is mostly price manipulation. institutions and goverments are loading up, just follow the the money....soon you can buy a house with just 1 btc",https://www.reddit.com/r/Bitcoin/comments/1n0r7ac/btc_to_1m_is_faster_than_you_think/,135,56,1n0r7ac,reddit,Bitcoin,btc,en,-0.3164
2025-08-26 16:44:39+00:00,"grok’s btc vs. usd video game analogy 🤯 i thought this was cool so i thought i would share. my prompt was based on some buttcoiner saying btc was “fake internet money”. :

imagine you’re playing a massive online multiplayer game where the in-game currency is used to buy everything—from virtual houses to weapons. critics of bitcoin often dismiss it as “fake internet money” because it’s digital, not backed by physical assets like gold, and created through complex computer processes (mining) rather than a central authority. but here’s an analogy that flips the script: **the us dollar (usd) is essentially the same kind of “fake internet money,” except it’s controlled by a single player with cheat codes, while bitcoin has built-in rules limiting how much can ever exist.**
picture the federal reserve (the fed) as the game’s all-powerful admin. when banks need more money to lend out (like when the economy slows down), the fed doesn’t dig it up from some vault or mine it from the earth—it just types a few commands into their digital ledger and poof, new bank reserves appear out of thin air. this is called quantitative easing or open market operations. it’s like the admin spawning unlimited gold coins in the game whenever players complain they’re broke. those reserves then multiply through fractional reserve banking, where banks lend out way more than they actually hold, creating even more digital dollars in the system. there’s no hard cap; the supply can inflate endlessly based on the fed’s decisions, which can lead to devaluation (inflation) if they overdo it. sure, it’s “real” money because the government says so and enforces its use through laws and taxes, but at its core, it’s just entries in a computerized database—no different from pixels on a screen.
now, contrast that with bitcoin: it’s like a game where the developers hardcoded a strict limit of 21 million coins ever, enforced by math and a decentralized network of players (miners) who all agree on the rules. no single admin can cheat and spawn more; you have to “earn” it by solving cryptographic puzzles, which gets harder over time. critics call bitcoin “fake” because it’s intangible and volatile, but it has scarcity baked in, making it more like digital gold than the fed’s infinite-print button.
in the end, both are “fake” in the sense that they’re human inventions relying on collective belief and technology to hold value. but if bitcoin is fake internet money, the usd is fake government internet money—with the added risk that the printer never runs out of ink. this analogy highlights why some bitcoin advocates argue it’s a hedge against fiat currencies like the usd, which can be debased at will.",https://www.reddit.com/r/Bitcoin/comments/1n0qyw4/groks_btc_vs_usd_video_game_analogy/,0,1,1n0qyw4,reddit,Bitcoin,btc,en,-0.7473
2025-08-26 16:43:16+00:00,bitcoin armory mirror needed hey all i had invested in bitcoin back in the day and the restore key is in the 16 line 5 numerical digits. which is one of armory’s oldest backs before they were encrypted with the new 8-21 word phrase. if anyone has information about this i would greatly appreciate the help!,https://www.reddit.com/r/Bitcoin/comments/1n0qxi8/bitcoin_armory_mirror_needed/,3,1,1n0qxi8,reddit,Bitcoin,btc,en,0.8047
2025-08-26 16:35:48+00:00,does anybody recommend the ton wallet? hello. i have some crypto saved in fidelity crypto but i don't have an actual crypto wallet used to spend crypto. i have telegram and telegram has a ton wallet and i was wondering if anybody has used it or like it? can you get btc with it?,https://www.reddit.com/r/Bitcoin/comments/1n0qqbh/does_anybody_recommend_the_ton_wallet/,4,7,1n0qqbh,reddit,Bitcoin,btc,en,0.7536
2025-08-26 15:43:32+00:00,"sold my 1 btc i just sold my 1 bitcoin to buy back later. i remember bought it when it was 13k when i was working at a min wage job. 
i have a weird feeling for selling it",https://www.reddit.com/r/Bitcoin/comments/1n0pcuf/sold_my_1_btc/,0,34,1n0pcuf,reddit,Bitcoin,btc,en,-0.0516
2025-08-26 14:38:45+00:00,"first hardware wallet purchase | for my future child. i want to buy £500 of bitcoin for my first “hardware wallet” and put this into storage for my future children.

what do i need to know before i do this and how can i go about this the right way?

planning to make washers with the seed phrase stamped into storage.. whatcha think?",https://www.reddit.com/r/Bitcoin/comments/1n0nmjr/first_hardware_wallet_purchase_for_my_future_child/,13,28,1n0nmjr,reddit,Bitcoin,btc,en,0.168
2025-08-26 13:19:10+00:00,the btc for the moment 🤯🥸,https://i.redd.it/i2qeg0hx6dlf1.jpeg,59,6,1n0lna1,reddit,Bitcoin,btc,en,0.0
2025-08-26 13:10:54+00:00,"bringing smart contracts & defi to bitcoin bitcoin has always been known as digital gold, the most secure and decentralized money in the world. but until recently, it lacked the ability to support smart contracts and defi at scale. that is where bitlayer, a bitcoin layer-2, comes in.

bitlayer uses the bitvm paradigm to bring programmability to bitcoin while maintaining bitcoin level security. users can pay gas fees directly in btc, which makes transactions simple and natural for bitcoin holders. the network also has a trust minimized bridge that issues 1:1 backed assets like ybtc, allowing people to put their bitcoin to work in lending, liquidity, and yield strategies without leaving the ecosystem.

the numbers show strong adoption. bitlayer currently secures around $430m in total value locked, ranking among the top bitcoin layer-2s, and has seen more than 51,000 active users in the past month. looking forward, bitlayer is preparing a major upgrade from a sidechain to a bitcoin native rollup, which would bring greater decentralization and scalability.

the project also has strong backing in asia, supported by a team with deep resources and community figures such as k-line master and he bi. one of the earliest exchanges to support bitlayer was bitget, which integrated the network before many others and continues to provide wallet support. bitlayer is also preparing to launch its token, though the broader story remains focused on how the network is scaling bitcoin for real-world use.

with its combination of smart contract support, secure bridging and upcoming rollup architecture, bitlayer is quickly becoming one of the most interesting experiments in bitcoin’s evolution, taking it beyond digital gold toward being the backbone of scalable defi.",https://www.reddit.com/r/Bitcoin/comments/1n0lg72/bringing_smart_contracts_defi_to_bitcoin/,0,1,1n0lg72,reddit,Bitcoin,btc,en,0.9977
2025-08-26 12:25:26+00:00,"ai can predict when you’ll move your bitcoin — even 3 days before you think about it we just dropped a new youtube video breaking down how ai and blockchain surveillance systems are tracking bitcoin holders, linking wallets to real identities, and even forecasting your next move.

this is the first episode in a weekly series we’re creating. every week we’ll release a new video diving into bitcoin, ai, and financial surveillance.

would love to hear your feedback",https://youtu.be/0OY6JB1Zl9k?si=NwnOvgHLytLuI_oa,0,3,1n0kewr,reddit,Bitcoin,btc,en,0.7717
2025-08-26 12:01:27+00:00,i just found my dads 676767 bitcoin wallet 😱 guys i need help! so my skibidi dad forgot the password to his paper wallet? can you guys help? 🥺😢🙏🙏,https://www.reddit.com/r/Bitcoin/comments/1n0jwd9/i_just_found_my_dads_676767_bitcoin_wallet/,0,8,1n0jwd9,reddit,Bitcoin,btc,en,0.7229
2025-08-26 10:55:34+00:00,bitcoin atm spotted in hong kong 🇭🇰,https://i.redd.it/xsr38yu9hclf1.jpeg,56,1,1n0im69,reddit,Bitcoin,btc,en,0.0
2025-08-26 10:36:45+00:00,"when in doubt, zoom out : always remember that the last entire bitcoin will take ~34,6 years to be mined 🤪",https://i.redd.it/gn5golcydclf1.jpeg,72,9,1n0iag3,reddit,Bitcoin,btc,en,-0.3612
2025-08-26 08:52:04+00:00,"random on ig wants to recover my wallet.dat ok so i posted on ig 11 years ago, asking if anyone knew how to recover a wallet.dat file.

on sunday someone i think from india replied, saying he has the software to recover this.

he sent me a dm and i said, well its a dead file to me.. i tried and it didnt work. however he has been hassling me since, non stop bombardment of messages and even trying to call me.

he said that he can't sleep over the fact it might have coin in it, as i used to mine. however it seems sketch as!! iv already been scammed out of 1.6btc on insta from someone promising mining contracts.

he now says that if i dont trust him, he can send me python code to unlock myself during a video call. i searched for scams as it seems super scammy.

anyone else experienced this on insta?

he said he is a freelance software developer and sent me a video of code which doesnt mean anything to me. he said he doesnt want the money (lol) and he would send me a contract (which wouldnt mean much since he's technically abroad to me)",https://www.reddit.com/r/Bitcoin/comments/1n0gm6m/random_on_ig_wants_to_recover_my_walletdat/,0,18,1n0gm6m,reddit,Bitcoin,btc,en,-0.4035
2025-08-26 08:40:06+00:00,"bought 0.2 bitcoin in 2017 at 15,000$ - going to start buying the “dip” now might buy some via ark etf as well",https://www.reddit.com/r/Bitcoin/comments/1n0gfr3/bought_02_bitcoin_in_2017_at_15000_going_to_start/,99,25,1n0gfr3,reddit,Bitcoin,btc,en,0.2732
2025-08-26 08:19:50+00:00,"bitcoin is deflationist ? hello, [r/bitcoin](https://www.reddit.com/r/bitcoin/)

i am interested in btc, and i’m still a novice about this subject. i’m accumulating sats :)  
so here is my question: a long time ago, when i read some books about economics and inflation, i understood that economists are really afraid of deflation. in my point of view, bitcoin is deflationary because, you know, there will only be 21 million btc.

i remember this point about deflation:

* money gains value over time
* people don’t consume a lot because money will be worth more tomorrow.
* companies invest less because money will be worth more tomorrow.
* lower wages and higher unemployment fewer jobs and lower salaries mean less money circulating. => people spend even less, pushing prices down further.
* back to the start

so in your opinion, why wouldn’t bitcoin have this effect on the economy if it were accepted by a lot of people?",https://www.reddit.com/r/Bitcoin/comments/1n0g4vj/bitcoin_is_deflationist/,2,34,1n0g4vj,reddit,Bitcoin,btc,en,0.7847
2025-08-26 08:05:24+00:00,"bitbox02 nova i’m planning on dca’ing into bitcoin for now, so i was looking at getting the bitbox02 nova bitcoin-only edition. the thing is, i’m not sure if i should just stick to that or get the multicoin version in case i decide to diversify later.

would it make more sense to just buy the bitcoin-only version now and, if i switch up later, get a different wallet for the other coins? or is it smarter to go with the multicoin version right away, even if i’m only holding btc for the foreseeable future?",https://www.reddit.com/r/Bitcoin/comments/1n0fx8x/bitbox02_nova/,0,3,1n0fx8x,reddit,Bitcoin,btc,en,0.3395
2025-08-26 07:26:56+00:00,"recovered my dad’s old blockchain.com wallet (14 btc), but stuck with forgotten password – need advice hey everyone,

i’m both excited and frustrated right now. after weeks of digging, i found that my dad actually bought around **14 btc back in 2015** on blockchain.com. the good news: i managed to recover access to the **email and keystore file** (not json, but the encrypted keystore). the bad news: nobody remembers the password.

here’s where i’m at:

* i’ve tried some tools like **btcrecover** and **hashcat**.
* i have some **password hints** from my dad’s old saved browser passwords (so i’m not shooting completely in the dark).
* i know some services claim they can crack wallets, but most look sketchy and i’d rather not trust strangers with this.

my question:

* has anyone here had **success stories** recovering a blockchain.com wallet with password hints?
* is it realistic to attempt this myself, or is it a dead end without professional help?
* if there are trusted communities or resources you recommend (guides, success stories, etc.), please point me there.

i’m not asking anyone to crack it for me — just want to know what’s actually worked for people and if there’s a **sane path forward** before i waste months on the wrong approach.

thanks in advance 🙏

## update 1 

 just wanted to share where i’m at and hopefully get some feedback:
* i figured out this is a non-custodial wallet. so if i don’t get the password, there’s no recovery option from blockchain.com.

* i went to blockchain.com, logged in with the wallet id, and by entering a wrong password i was able to get back the wallet.aes.json file (encrypted wallet backup).

* i have around 20 base password variations that my dad typically used. using those, i generated about 1 million variants with the help of tools + llms.

* i tried those against the wallet.aes.json using btcrecover (cpu-based), but no luck so far.

my next step: i want to move this to hashcat (gpu-based) so i can test more possibilities.

now i’m considering a few approaches, and would love input from anyone who’s been through something similar:

* expand the wordlist: take my 20 known password hints and generate ~20–50 million variations (instead of just 1m) and run them in hashcat.

* pattern-based attack: try to define regex-style rules or patterns in hashcat, based on what i know about my dad’s password habits, instead of just a big flat wordlist.

other smarter approach? maybe i’m missing a more efficient way to combine hints + patterns so i’m not brute forcing blindly.

so my question is: what’s realistically the best way forward here? is it worth generating massive wordlists, or should i focus on getting good rules/patterns for hashcat?

any tweaks, tips, or alternative methods are welcome 🙏",https://www.reddit.com/r/Bitcoin/comments/1n0fc41/recovered_my_dads_old_blockchaincom_wallet_14_btc/,1038,339,1n0fc41,reddit,Bitcoin,btc,en,0.9803
2025-08-26 07:20:24+00:00,what does this comic mean? this was in bitcoin magazine in november 2024. barnes & noble california. i remember i took this picture why? because i didn’t quite understand what it was saying. but i took the picture because i do like it. it has a hopeful feeling.,https://i.redd.it/56rthm1xeblf1.jpeg,95,50,1n0f8jf,reddit,Bitcoin,btc,en,0.8959
2025-08-26 06:41:29+00:00,tell me your holding through btc winter stories winter is coming,https://i.redd.it/d7mtcx5y7blf1.png,0,24,1n0ench,reddit,Bitcoin,btc,en,0.0
2025-08-26 06:29:57+00:00,"easy way to buy bitcoin hi all,

i don’t have a lot of money but i want to put a little bit on bitcoin. which app is the easiest and cheapest to buy bitcoin. i am not in the us. thank you.",https://www.reddit.com/r/Bitcoin/comments/1n0egwk/easy_way_to_buy_bitcoin/,0,3,1n0egwk,reddit,Bitcoin,btc,en,0.8537
2025-08-26 06:09:56+00:00,"daily discussion, august 26, 2025 please utilize this sticky thread for all general **bitcoin** discussions! if you see posts on the front page or /r/bitcoin/new which are better suited for this daily discussion thread, please help out by directing the op to this thread instead. thank you!

if you don't get an answer to your question, you can try phrasing it differently or commenting again tomorrow.

please check the [previous discussion thread](https://www.reddit.com/r/bitcoin/comments/1mzjmsg/mentor_monday_august_25_2025_ask_all_your_bitcoin/) for unanswered questions.",https://www.reddit.com/r/Bitcoin/comments/1n0e5kl/daily_discussion_august_26_2025/,26,56,1n0e5kl,reddit,Bitcoin,btc,en,0.9272
2025-08-26 05:20:37+00:00,bitcoin,https://i.redd.it/ceczb5tjtalf1.jpeg,7,2,1n0dckj,reddit,Bitcoin,btc,en,0.0
2025-08-26 05:16:08+00:00,"is this a right time to go all-in or will it be cheaper in future? my money was on interest, now i got it back and don't know what to do with it, i was waiting bitcoin drop to 90k but i feel like this might be the last chance to see bitcoin at 110k and it will never go below 100k. what do you say, should i go all in or wait for a while for a better chance? (and no i'm not going to split the money)",https://www.reddit.com/r/Bitcoin/comments/1n0d9v0/is_this_a_right_time_to_go_allin_or_will_it_be/,0,37,1n0d9v0,reddit,Bitcoin,btc,en,0.8782
2025-08-26 05:05:59+00:00,"i just bought btc for the first time! hey guys, i know prob no one cares about this but i just wanted to share that i finally bought some bitcoin for the first time :)

this is the start of my stacking journey and i’m planning to dca every week no matter what happens. i know september usually isn’t the best month and price might go down a lot, but i’m in this for the long term so i don’t really mind.

kinda excited to finally be a part of this journey instead of just watching from the sidelines. let’s see where this goes :)",https://www.reddit.com/r/Bitcoin/comments/1n0d3t0/i_just_bought_btc_for_the_first_time/,76,18,1n0d3t0,reddit,Bitcoin,btc,en,0.9623
2025-08-26 04:22:52+00:00,this is a bitcoin coin made from 1 oz 99.99% silver👍📈🚀,https://www.reddit.com/gallery/1n0cceg,0,8,1n0cceg,reddit,Bitcoin,btc,en,0.0
2025-08-26 04:17:03+00:00,"started stacking 22 days ago, just reached 1% of a bitcoin :) 5% is the next goal",https://www.reddit.com/gallery/1n0c8na,482,64,1n0c8na,reddit,Bitcoin,btc,en,0.5267
