timestamp,text,url,score,num_comments,id,source,subreddit,coin,lang,sentiment
2025-08-26 04:08:29+00:00,"to the more experienced hodlers at what price do you guys think this dip will bottom out at?

i'm not super familiar with these dips in the cycle, but i do want to get the most btc i can with the money i'm putting in.

why would i continue to put money in at $112k, or $109k if the community thinks the dip will bottom at $90k. i'd rather wait and put lump sums in at $100k or $95k or whatever i think is relatively close to the bottom.

edit:

thank you for those first few commentors who have been treating this as an opportunity to educate. i appreciate you! keep providing input!

i don't have disposable income at this point i my life, so it feels a little scary even though i believe bitcoin is the currency of the future. it's not a lack of faith.",https://www.reddit.com/r/Bitcoin/comments/1n0c308/to_the_more_experienced_hodlers/,0,38,1n0c308,reddit,Bitcoin,btc,en,0.7223
2025-08-26 04:03:53+00:00,"just sold a bunch of stuff in time for buying the dip. i just sold 3 babulabs 3d printers, along with some old camera gear and sonos speakers, to free up cash and buy the dip.

my average purchase price is around **$115,500**. like everyone else, i’m down right now, but the fundamentals of bitcoin are just too hard to ignore.

this isn’t about *trading* bitcoin. it’s about *understanding* it. the fundamentals speak for themselves. when stablecoins became regulated and the u.s. decided to ban the creation of a government-backed cryptocurrency, the writing on the wall became clear to me.

bitcoin is about fundamentals. that’s why i’m here.

wishing you all strong conviction and diamond hands, i’m hodling right alongside you.",https://www.reddit.com/r/Bitcoin/comments/1n0bzzg/just_sold_a_bunch_of_stuff_in_time_for_buying_the/,15,10,1n0bzzg,reddit,Bitcoin,btc,en,0.8442
2025-08-26 03:41:27+00:00,"bitcoin keeps steady at 100k is actually good for us with < 1btc bitcoin keeps steady ad 100k is actually a good things for those who own less than 1 btc. considering bitcoin goes rocket high, said 10m, but for those who only own 0.1 or 0.01 btc, this amount is still not big enough to set one free. on the contrary, if we can stacks sats at this level for a longer time of period, it will be better for the future.",https://www.reddit.com/r/Bitcoin/comments/1n0bkmn/bitcoin_keeps_steady_at_100k_is_actually_good_for/,0,10,1n0bkmn,reddit,Bitcoin,btc,en,0.9042
2025-08-26 02:45:59+00:00,someone at my local steak n shake likes bitcoin first the window sticker now the wall! neat-o,https://i.redd.it/dpmiucly1alf1.jpeg,19,4,1n0ahqx,reddit,Bitcoin,btc,en,0.3382
2025-08-26 02:13:41+00:00,"don’t panic! i made this simple, crystal-clear bitcoin chart to guide beginners through these uncertain times 🚀",https://i.redd.it/0yheqq42w9lf1.jpeg,330,32,1n09tr5,reddit,Bitcoin,btc,en,-0.6996
2025-08-26 01:52:51+00:00,limited bc question hey so i'm rather new to bitcoin but have been following for a long time. i have a question regarding it's divisibility. sure bc is only 21 million but it's also divisible to infinity. how is does mean there is any kind of limited supply? please help me out here. how am i not a sucker for buying .0002 bitcoins when .00002 might be just around the corner. need some professional help here.,https://www.reddit.com/r/Bitcoin/comments/1n09dmw/limited_bc_question/,0,34,1n09dmw,reddit,Bitcoin,btc,en,0.9308
2025-08-26 01:20:31+00:00,bitcoin & the machine state ritual,https://johnbmint.substack.com/p/bitcoin-and-the-machine-state-ritual,5,2,1n08oh2,reddit,Bitcoin,btc,en,0.0
2025-08-26 01:10:56+00:00,"pay attention ""btc is dead"" shouters, paper hands and newbies. https://preview.redd.it/mmrpg2c0j9lf1.png?width=1220&format=png&auto=webp&s=f3c16a171bcb2c85d21755dbfe2b23430c9c9ba1

first of all here is the link to the page for the picture above: [https://bitbo.io/dead/](https://bitbo.io/dead/)  
another eye opener: [https://bitcoindeaths.com/](https://bitcoindeaths.com/)

  
i recently saw a lot of people looking at btc hitting ath and then continuing with a correction, and people asking ""i just bought should i sell??"", ""bull market is over? i will buy at 50k!"". first, if you're looking to make big money with btc fast, you are investing in an asset class that you do not understand and is probably not good for your mental health. all these people you see who made millions off of bitcoin, gaining freedom, being mortgage free, they all started somewhere. you are telling me, you are skeptical about btc after it is correcting from an ath of $123,000? the stories you see from people are the ones who once believed in btc when it was at $100 or even $10,000, it was the exact same situation, no one knew what's going to happen, fud in the market was still at its peak.   
  
there are many people who have shared plethora of resources to learn about btc, books like ""the bitcoin standard"", ""broken money"" and videos like ""what's the problem?"" and websites like [https://www.satsvsfiat.com/](https://www.youtube.com/redirect?event=video_description&redir_token=quffluhqbtjqvwdvdtffaevdt0l4zm9sddhhy2fbdvfjd3xbq3jtc0ttanhrung1lwizbfpwdxvun2o2nknetnztetg4rfdwymlobu5hak5rn0znshlmdjlrb3zoenjuetl1sv9dukrettdny3lymhbsuzayd21kuv94yy1jqnzozwjymmjku2r0zxncltftbxvpnvfwtxewwq&q=https%3a%2f%2fwww.satsvsfiat.com%2f&v=ytfoxnbmd38). before you see the $$$ signs attached next to btc, understand what it is about, why satoshi nakamoto believed in such an idea and decided to share it with the world, why he saw a world where everyone had freedom, where everyone would not work till death against a system that is designed to make them lose. and if you still wish to make $$$ off of bitcoin then at least understand it is not a get rich quick scheme, it is a lesson that patience and perseverance wins, as bitcoin always has against every skeptic, every action of unethical exchanges and attempts of governments to ban it (like the china mining ban a few years back). open your eyes, see the reality. that paper money in your hand is making you weak and the sad part is the more you get of it, the more you believe in it.   
  
i hope you all find the strength to get out of the fiat system that is already rigged against you and understand that true value of life is not how much bank you make, or how much your btc holding is in $$$, but of how free you can be in a world where slavery has become a socially accepted behaviour.",https://www.reddit.com/r/Bitcoin/comments/1n08gsx/pay_attention_btc_is_dead_shouters_paper_hands/,125,21,1n08gsx,reddit,Bitcoin,btc,en,0.7236
2025-08-26 00:51:05+00:00,"what do i do with bitcoin now hey guys, i'm just starting out in the market and i saw that bitcoin is falling. i would like your opinion: is it worth buying heavily now, waiting to see if it drops more or selling everything at once?",https://www.reddit.com/r/Bitcoin/comments/1n080z4/what_do_i_do_with_bitcoin_now/,0,34,1n080z4,reddit,Bitcoin,btc,en,0.4215
2025-08-26 00:43:49+00:00,"has anyone seen this symbol in relation to bitcoin? https://preview.redd.it/vjlk5p90g9lf1.png?width=878&format=png&auto=webp&s=58d6e7a04ec399c15ebe006672cc40f7e3dedfb5

found on an envelope. it is either bitcoin or crypto related to some capacity.",https://www.reddit.com/r/Bitcoin/comments/1n07v6e/has_anyone_seen_this_symbol_in_relation_to_bitcoin/,0,3,1n07v6e,reddit,Bitcoin,btc,en,0.0
2025-08-25 22:10:47+00:00,"don’t hide cash at home: use cryptocurrencies instead / how crypto is the alternative to the system you've been seeking all along tl;dr: this article is more aimed at beginners and people fearful of crypto (but then, the bitcoin beginner subreddit does not allow articles, only questions), and explores options on how and why cryptocurrencies can bring freedom to one's finances, and be an alternative to people who sought to get away from official institutions by keeping their money at home.",https://medium.com/technology-hits/dont-hide-cash-at-home-use-cryptocurrencies-instead-d698a2e75817?sk=v2%2F205260cd-20db-41f1-be1b-03f769f1c03b,105,1,1n04ca5,reddit,Bitcoin,btc,en,-0.0941
2025-08-25 21:35:50+00:00,"was bitcoin also your introduction on the concept of infinite and finite currencies too? i can't imagine many people outside of economists would understand. why have i never heard about this issue before? we all learn about taxes and inflation but i don't remember anyone talking about what we the people need is a kind of currency that can't be reproduced from nothing. it's like bitcoin is largely solving a problem the common ~~dumbass~~ citizen wasn't even aware of and that's a big part of why it's not being accepted the way i thought it would be. idk man, it's staggering to me trying to talk to people about it. i brought it up to my chiropractor and his opinion is that because it's digital it can't really replace anything as a currency. i guess i'll let him figure it out in his time. anyway thanks for reading my rant and happy stacking.",https://www.reddit.com/r/Bitcoin/comments/1n03gkz/was_bitcoin_also_your_introduction_on_the_concept/,12,6,1n03gkz,reddit,Bitcoin,btc,en,0.3013
2025-08-25 21:13:21+00:00,why bitcoin treasury companies are a fool’s paradise,https://www.ft.com/content/478ea5bc-ea18-44f7-9da1-602ebe283fca,2,3,1n02vge,reddit,Bitcoin,btc,en,0.7184
2025-08-25 21:00:29+00:00,"what else can we do? i recently bought btc at about 117k. then panic sold when it hit 114. and bought again at 115. as i know myself , i decided to move everything to a cold wallet (it was in the exchange).
if it hits below 110k do you know what am i gonna do? yessss… i’m gonna dca my life out. the decision is taken. otherwise, as the title says, what else?",https://www.reddit.com/r/Bitcoin/comments/1n02j6g/what_else_can_we_do/,0,47,1n02j6g,reddit,Bitcoin,btc,en,-0.5913
2025-08-25 20:39:54+00:00,"i had £50 in btc that i bought 3-4 years ago. totally forgot about it. randomly logged in first time in a while and it was worth £303. i’m skint and needed a new washing machine.

btc literally saved my arse.

every pay day i will now invest.

gg btc gg",https://www.reddit.com/r/Bitcoin/comments/1n01znh/i_had_50_in_btc_that_i_bought_34_years_ago/,117,8,1n01znh,reddit,Bitcoin,btc,en,0.7717
2025-08-26 20:32:43+00:00,bitcoin is ‘funny internet money’ during a crisis: tezos co-founder,https://cointelegraph.com/magazine/tezos-blockchain-arthur-breitman-calls-bitcoin-funny-internet-money/,1,1,1n0x1mz,reddit,CryptoCurrency,btc,en,-0.6249
2025-08-26 19:47:09+00:00,"bitcoin security vs nano security : transaction confirmation speed and irreversibility let's dive into one of the key differences between btc and xno (nano): 

how quickly and irreversibly transactions confirm.

bitcoin :
confirmations are *probabilistic*. each block adds security, but it's not instant. 

for high confidence (say, 6 confirmations to avoid double-spends), you're looking at ~1 hour on average (blocks every ~10 mins). it's secure but slow, not ideal for quick coffee buys.

reversals are possible in theory via chain reorgs, though rare in bitcoin but happening now in other pow chains 

nano

*deterministic* finality. using a block-lattice and open representative voting (orv), transactions confirm under 1 second! 

once voted on by reps, it's irreversible. no mining, no fees, feeless and eco-friendly. perfect for microtransactions or daily use.",https://www.reddit.com/r/CryptoCurrency/comments/1n0vtyh/bitcoin_security_vs_nano_security_transaction/,0,7,1n0vtyh,reddit,CryptoCurrency,btc,en,0.4172
2025-08-26 18:58:45+00:00,ceo of coinbase asset management says bitcoin and crypto markets could explode in ‘south sea bubble’-style move – here’s his forecast,https://dailyhodl.com/2025/08/26/ceo-of-coinbase-asset-management-says-bitcoin-and-crypto-markets-could-explode-in-south-sea-bubble-style-price-swings-heres-his-forecast/,9,5,1n0ukde,reddit,CryptoCurrency,btc,en,0.3612
2025-08-26 15:13:11+00:00,bitcoin q2 dip similarities 'uncanny' as coinbase premium flips green,https://cointelegraph.com/news/bitcoin-q2-dip-similarities-uncanny-as-coinbase-premium-flips-green,5,6,1n0ojli,reddit,CryptoCurrency,btc,en,0.0
2025-08-26 15:05:08+00:00,"how cross-chain bridges work # tl;dr

* cross-chain bridges enable assets, data, and information to be transferred between isolated blockchain networks, providing interoperability.
* interoperability is crucial to unifying isolated blockchain ecosystems and improving user experiences.
* cross-chain bridges provide dapps and tokens with multi-chain strategies that can increase volume, liquidity, and profitability.
* token holders benefit from access to new opportunities, lower fees, and enhanced accessibility.

# understanding how cross-chain bridges work

a cross-chain bridge is a protocol that enables the transfer of assets, data, or information between various blockchain networks. it allows users to interact with different blockchains, unlocking interoperability by facilitating communication and transactions between otherwise isolated ecosystems. bridges are great for transferring tokens, using dapps across chains, and optimizing blockchain functionalities.

# what types of cross-chain bridges are there?

there are several types of bridges in the web3 space, each serving a different purpose and need. as these bridges serve different roles, they operate in different ways. here is a brief overview of different types of bridges: 

**trust-based bridges**

trust-based bridges depend on a centralized authority to facilitate cross-chain asset transfers. despite being less susceptible to hacking, trust-based bridges require trust in the authority. trust-based bridges can support any asset, and all cross-chain bridges tend to fall between the categories of trust-based bridges or trustless bridges.

**trustless bridges**

as its name suggests, trustless bridges operate without a central authority. in contrast, trustless bridges rely on nodes or smart contracts, depending on the type of bridge.

**wrapped asset and altcoin bridges**

many bridges focus on transferring wrapped assets and altcoins across different chains. many of the assets are wrapped versions of popular cryptocurrencies, such as wrapped bitcoin (wbtc), or less popular altcoins and tokens. bridging these assets cross-chain opens up trading and arbitrage opportunities, as well as a higher trading volume on dexs for the asset. 

**stablecoin bridges**

other bridges focus on various stablecoins such as usdt, usdc, and dai. some stablecoin bridges have integrated different bridging protocols, such as circle’s cctp for usdc or chainlink’s ccip, to allow the movement of these assets. 

**nft bridges**

while nfts may have lost some of their glamour, some bridges focus on transferring digital collectibles or nfts across chains. nft bridges tend to be relatively rare, as market interest in digital collectibles has died down, and meme coins have become the recent craze. 

# how do cross-chain bridges work?

there are several types of bridging methods used in cross-chain bridges, depending on the specific bridge. here are a few common methods:

**lock and mint bridging**

one of the most common ways cross-chain bridges work is by using a lock and mint functionality. in this method, tokens are locked on one chain, and an equivalent number of tokens is minted on the other. should the user want to bridge assets back to their original chain, the newly minted version of the tokens is burnt, and the locked tokens are released.

**burn & mint bridging**

as its name suggests, with burn and mint, tokens are burnt (destroyed) on the source chain, and equivalent native tokens are minted on the destination chain. it is popular for one-way token bridging because it removes the source tokens from circulation.

**liquidity pool bridging**

with liquidity pool bridging, a token that exists on multiple blockchains is deposited into a large multi-chain digital pool of liquidity. this liquidity pool allows users to swap the token between supported blockchains easily, and liquidity providers earn a small fee every time a user bridges tokens. this approach eliminates the need for complex minting or burning processes, as tokens are exchanged directly in the liquidity pool.

**atomic swap bridging**

in atomic swap bridging, users swap assets on the source chain for assets on the destination chain. two users agree on the token swap terms, such as the amount and blockchain networks involved. to ensure the security of the transaction, hash time-locked contracts (htlcs) are used to ensure it takes place simultaneously on both chains or not at all

# why interoperability in web3 matters

blockchains are like isolated islands, each with its unique ecosystem, but with limited interaction. the isolation of blockchains creates a massive problem for the end user, which bridges help solve by transferring information and assets, essentially unifying these islands. 

as blockchain and web3 grow, so too will the importance of interoperability.

**the need for cross-chain asset transfer**

for many top dapps and tokens, a multi-chain strategy is essential to stay competitive and maximize profits, avoiding the limitations of running on a single, isolated chain. smaller tokens and dapps also benefit by increasing trading volume through listings on multiple dexs across different chains.

from a token holder’s perspective, cross-chain asset transfers allow access to diverse opportunities, such as lower fees or unique features.

# key benefits of cross-chain bridges

there are many different benefits to using cross-chain bridges, both for dapps and tokenized web3 projects, as well as for token holders. for dapps, cross-chain bridges can help grow their ecosystem. bridging tokens can increase their trading volume and liquidity by getting listed on several dexs. 

token holders, on the other hand, can benefit from a better user experience and easier access to assets.

# challenges and risks

the greatest risk with cross-chain bridges is their security. as the popularity of cross-chain bridges continues to grow, so does the risk of attacks. hackers are constantly seeking vulnerabilities in these protocols, making it essential to stay secure.

most hacks occurred due to flaws in smart contracts. other hacks occurred due to insufficient validation schemes, social engineering, and, as we’ve seen with harmony horizon bridge, private key compromises.",https://www.reddit.com/r/CryptoCurrency/comments/1n0obj9/how_crosschain_bridges_work/,4,8,1n0obj9,reddit,CryptoCurrency,btc,en,0.9983
2025-08-26 14:53:13+00:00,"proof of work (pow) is killing crypto investments proof-of-work's massive energy use makes it environmentally unsustainable for crypto funds, as seen in bitcoin's high consumption equivalent to countries.  


monero's 2025 51% attack by qubic highlights pow's vulnerability to centralized mining power, freezing exchanges and eroding trust. 


bitcoin's mining centralization, with top pools controlling most hashrate, risks censorship and systemic failures, deterring stable investments.  


switching to open proof-of-stake or dpos  eliminates these issues, slashing emissions by 99%, enhancing security, and aligning with regulatory and esg demands for long-term viability.",https://www.reddit.com/r/CryptoCurrency/comments/1n0o026/proof_of_work_pow_is_killing_crypto_investments/,0,15,1n0o026,reddit,CryptoCurrency,btc,en,-0.7564
2025-08-26 14:18:24+00:00,"french chipmaker sequans plans $200 million share sale to build bitcoin treasury here we have another company going and creating a btc treasury. it is interesting to see that the company is located in europe (france) given the confusion and just general issues crypto has faced in europe. 

more power to them though and with the current pullback its a solid opportunity to take advantage and stack more sats then they otherwise would have been able to! time will tell if companies keep doing this and if it as at the current pace that we are seeing.

personally i think strategy needs to stop buying just because they are becoming such a whale at this point.",https://decrypt.co/336838/french-chipmaker-sequans-200-million-share-sale-bitcoin-treasury,9,4,1n0n3sa,reddit,CryptoCurrency,btc,en,0.8748
2025-08-26 13:45:08+00:00,"hodl on - i can feel it in these trying times, i'm bringing back this gem. old ogs will remember this one.

i'm in deep, you're in deep, and bitcoin has dropped from 122k to 109k. people are getting fearful, but let's keep it all in perspective. this is statistically a small drop percentage wise. ogs will remember 30-40% draw downs in hot bull markets with bitcoin and it wasn't a cause for concern. it was, in fact, normal. this is needed to flush everybody out, reset the system, and allow bitcoin to continue it's march higher. 

don't panic sell all your bags before the last big pump of the cycle. hodl on ladies and gentlemen, hodl on.",https://youtu.be/Yaxq3iggMdM?si=78SAvJDceP4vrxW-,0,0,1n0m9ud,reddit,CryptoCurrency,btc,en,0.7433
2025-08-26 11:55:31+00:00,"trading crypto via a multi-asset broker—good idea? most traders i know stick to binance or bybit, but i’m considering a broker that handles both crypto and fx. the goal is managing eth, btc, and usd/jpy together without juggling accounts.
has anyone done this? how does liquidity and execution compare to major crypto exchanges?",https://www.reddit.com/r/CryptoCurrencyTrading/comments/1n0jrrf/trading_crypto_via_a_multiasset_brokergood_idea/,1,1,1n0jrrf,reddit,CryptoCurrencyTrading,btc,en,0.0
2025-08-26 20:27:15+00:00,"bitcoin security vs nano security : transaction confirmation speed and irreversibility let's dive into one of the key differences between btc and xno (nano): 

how quickly and irreversibly transactions confirm.

bitcoin :
confirmations are *probabilistic*. each block adds security, but it's not instant. 

for high confidence (say, 6 confirmations to avoid double-spends), you're looking at ~1 hour on average (blocks every ~10 mins). it's secure but slow, not ideal for quick coffee buys.

reversals are possible in theory via chain reorgs, though rare in bitcoin but happening now in other pow chains 

nano

*deterministic* finality. using a block-lattice and open representative voting (orv), transactions confirm under 1 second! 

once voted on by reps, it's irreversible. no mining, no fees, feeless and eco-friendly. perfect for microtransactions or daily use.",https://www.reddit.com/r/CryptoMarkets/comments/1n0wwec/bitcoin_security_vs_nano_security_transaction/,1,1,1n0wwec,reddit,CryptoMarkets,btc,en,0.4172
2025-08-26 18:47:40+00:00,bitcoin in 2026?,/r/Bitcoin/comments/1n0u8uq/bitcoin_in_2026/,2,1,1n0ua21,reddit,CryptoMarkets,btc,en,0.0
2025-08-26 17:47:07+00:00,"trying to figure out what comes next after some unexpected gains this cycle has been wild — i started with what i thought was just “extra” savings, and it’s grown into way more than i ever pictured. honestly, it feels a little unreal to see the numbers now.

but it’s also left me with a big question: what’s the smartest move when things cool down? do people usually cash out into real-world assets, roll it back into btc/eth, or keep going deeper into alts?

i’m not trying to flex — more just surprised at how quickly things escalated and trying to learn from those who’ve been here before. if you’ve had success in past cycles, how did you handle it? did you protect your gains, or did you double down?

would love to hear both good and bad experiences — what worked, what didn’t, and what you’d do differently.",https://www.reddit.com/r/CryptoMarkets/comments/1n0soip/trying_to_figure_out_what_comes_next_after_some/,15,19,1n0soip,reddit,CryptoMarkets,btc,en,0.9876
2025-08-26 17:19:19+00:00,bbusdt i feel bitcoin is gonna pop starting the alt season. btc dominance to hit 54%. got a long position on bbusdt. any thoughts?,https://www.reddit.com/r/CryptoMarkets/comments/1n0rxe3/bbusdt/,0,1,1n0rxe3,reddit,CryptoMarkets,btc,en,0.2023
2025-08-26 17:00:35+00:00,future of bitcoin in finance with maestro - youtube podcast,https://www.youtube.com/watch?v=3KWOYHJZlnw,1,5,1n0reko,reddit,CryptoMarkets,btc,en,0.0
2025-08-26 16:48:10+00:00,"alt season 2025 what are your expectation for this altseason? 
so far i have seen mainly a bitcoin bullrun during this cycle. alts pumped last year november to january but after that they were bleeding for the majority of 2025. most likely in september further bleeding will be happening. as from my point of view we will have one last pump during november/december before the final downtrend will start.
btc and eth and maybe another handfull ls has achieved new ath. but other than that it was very disappointing cycle i have to say. 
what are your strategies for the next months? 
when do you expect the top for alts to come? 
how long will a proper alt season last?",https://www.reddit.com/r/CryptoMarkets/comments/1n0r2b6/alt_season_2025/,30,49,1n0r2b6,reddit,CryptoMarkets,btc,en,-0.6704
