timestamp,text,url,score,num_comments,id,source,subreddit
2025-07-25 04:03:52+00:00,"the bitcoin bloodbath: why whales just set the stage for a monster rally. $btc falls to 116k in minutes! what the hell just happened?



if you watched bitcoin’s price action today, you might have felt a jolt of panic. a sudden, gut-wrenching plunge that sent the price tumbling and social media into a frenzy. it looked like a classic crypto crash—but it wasn’t.



what you just witnessed was a masterclass in market manipulation, a strategic “shakeout” orchestrated by the giants of the crypto world—the whales. and if you understand their game, you’ll see this bloodbath wasn’t an ending. it was a beginning. in fact, it's the clearest sign we have that a significant price spike is likely on the horizon.



1. the anatomy of a takedown

first, let’s break down what happened. this wasn’t random selling. it was a targeted strike. using sophisticated tools like liquidation heatmaps, large traders can see exactly where massive pools of ""leveraged long"" positions are sitting. these are essentially bets from smaller traders that the price will go up, but they've borrowed money to amplify their bet. it’s risky, and the whales know it.



this week, the heatmap was lit up like a christmas tree, showing billions of dollars in these leveraged positions just below the market price. it was a sitting duck. whales began to push the price down, just enough to hit the first of these liquidation zones.

what followed was a domino effect—a liquidation cascade.

when the first group of leveraged traders was wiped out, their positions were automatically sold, adding massive selling pressure. this pushed the price down further, hitting the next liquidation zone, and then the next. it was a controlled demolition, designed to do one thing: clear out the ""dumb money"" and create a clean slate.



2. the motive: a pre-emptive strike before the fed

so, why now? look at the calendar. next week, the u.s. federal reserve holds its fomc meeting, where it will make a crucial decision on interest rates. this is one of the most significant market-moving events of the year.

whales don't like uncertainty. the period before a fed announcement is filled with nervous energy and unpredictable swings. by triggering this liquidation cascade \*before\* the meeting, they achieve three brilliant strategic goals:



\-  they de-risk the market: by flushing out the over-leveraged and panicky traders, they stabilize the market on their terms, reducing the chaos that could ensue after the fed's announcement.



\-  they engineer a discount: this manufactured crash allows them to buy up huge amounts of bitcoin at a bargain price. while everyone else was panic-selling, they were quietly accumulating, loading their bags for the next leg up.



\-  they seize control of the narrative: a sharp drop creates fear. but for those who know what to look for, it signals opportunity. the whales have now set the stage to profit from the rebound they themselves will help create.



3. the grand finale: get ready for the spike

this brings us to the most exciting part. this aggressive, strategic takedown isn't a sign of a bear market. it's the prelude to a powerful rally. having cleared the board and filled their positions at a discount, the whales are now perfectly positioned for what comes next.

the consensus is growing that the federal reserve will signal a more ""dovish"" stance, opening the door for future interest rate cuts. such a move would be rocket fuel for risk assets like bitcoin.



with the over-leveraged players gone and the market reset, there's now very little resistance to the upside. the selling pressure has been artificially exhausted. the path of least resistance is now firmly upwards.

don’t be fooled by the red candles and the fearful headlines. the game is played in the shadows, and the whales just showed their hand. they’ve cleared the path, taken their positions, and are ready for the next major move. this wasn't a crash. it was a launch sequence. buckle up.

\#fed #bitcoin #crypto #whales",https://www.reddit.com/r/CryptoMarkets/comments/1m8pdes/the_bitcoin_bloodbath_why_whales_just_set_the/,1,4,1m8pdes,reddit,CryptoMarkets
2025-07-24 20:18:45+00:00,"i genuinely believe trump is pro-crypto so he can benefit from fraud, and get away with it legally at this point, people surely have to see why trump is so pro-crypto, and it's not out of altruism or the greater good. i'm actually apolitical so think both dems and republicans are corrupt assholes, but trump's playbook is as clear as daylight, and world liberty financial is all we needed to see.

put simply, as much as i love crypto, the current volatility and speculation of a market that is still tiny compared to more trad markets, is an ideal environment for a grifter politician like trump to make insane money  (via his family and associates) from pump and dumps, and legally; and then putting those fraud earnings into btc.

think about it, if trump lays the foundations for bitcoin and crypto to go more mainstream, and under the guise of a legitimate but ""speculative"" investment asset class (meaning the blame is put on investors if they lose their money), then there is literally no way for his wlf associates to face any accountability in court. he will use the typical ""the risk is on the investor, and therefore no one is to blame if they lose their money"" excuse. 

this may not have been explained in the best way, but mark my words, that narcissistic grifter never does anything unless he can ""personally"" benefit from it. 

inb4 his cult followers come to defend him (even though he spat in the face of every crypto proponent  with what he did (people will say it was his associates and fam, but he knew) with world liberty financial. part of a cult.",https://www.reddit.com/r/CryptoMarkets/comments/1m8f48v/i_genuinely_believe_trump_is_procrypto_so_he_can/,561,210,1m8f48v,reddit,CryptoMarkets
2025-07-24 13:23:30+00:00,"altcoins are mixed while bitcoin’s dominance remains strong (~59%), many alts are down 5–10% from recent highs. eth is holding better than most, while meme coins and low-caps are struggling.",https://www.reddit.com/r/CryptoMarkets/comments/1m84bjc/altcoins_are_mixed/,14,20,1m84bjc,reddit,CryptoMarkets
2025-07-24 10:58:06+00:00,"would anyone say this a good time to move btc holdings into alts? (eth, xrp, hbar, some others) i know, i know, nobody knows sh*t about f*ck. i just want to know if other people agree or disagree and why. with altseason now coming “soon”, and the altseason index having dropped today, it’d be a good time to make a decision if alts are going to surpass btc in gains these coming months. i’m currently 55% btc, 20% eth, 4% sol, doge, xrp and smaller amounts of a few more. if i weren’t to invest more, or even if i did, would it be advisable to cut btc in half and move to alts?

my btc is in profit, some alts are held from previous highs including dec24/jan25 so some have not recovered investment.

info: plan on selling at some point this year. i just want to take profit near the top like i haven’t in the past two cycles. then dcaing all back into btc over the next few years. 

more info: these are not large amounts.",https://www.reddit.com/r/CryptoMarkets/comments/1m81a8g/would_anyone_say_this_a_good_time_to_move_btc/,43,78,1m81a8g,reddit,CryptoMarkets
2025-07-24 10:45:49+00:00,how much crypto should i have in my portfolio? is there a typical rule of thumb for an allocation to crypto in a portfolio? i currently hold about 10% crypto (bitcoin and ether) as an overall investment. while i understand risk tolerance plays a factor - any thoughts if this should remain or +/- in my overall portfolio.,https://www.reddit.com/r/CryptoMarkets/comments/1m812fv/how_much_crypto_should_i_have_in_my_portfolio/,4,22,1m812fv,reddit,CryptoMarkets
2025-07-23 22:16:12+00:00,"market is waiting on bitcoin market is always lead by bitcoin whether we like it or not. when bitcoin moves up a little, altcoins in the rest of the market moves up even more. bitcoin has been range bound between 116k-122k for 13 days (tomorrow will be 2 weeks). during an uptrend, thats usually too long of a wait for people so i think today's bloodbath is because people are getting impatient and anxious with bitcoin. it needs bitcoin to pump back to either recent aths at around 122k quickly and then pump higher or else the bull trend loses steam. people get anxious in these uncertain situations and will click sell if they have to wait too long for bitcoin signal. hoping it can pump back to 122k by tomorrow for the much needed confirmation.",https://www.reddit.com/r/CryptoMarkets/comments/1m7n0ip/market_is_waiting_on_bitcoin/,72,42,1m7n0ip,reddit,CryptoMarkets
2025-07-23 21:59:59+00:00,"white house dropping their crypto playbook july 30, what to expect? government just spent 6 months figuring out their crypto strategy and they're releasing it next week, what this could bring for anyone holding crypto or thinking about getting in.

good stuff: bitcoin reserve proposal - if the government starts holding bitcoin alongside their gold reserves, that would mean that btc has real value in us economical terms.

fed access for crypto companies - this is huge but boring. right now, crypto companies have to go through regular banks to move dollars around, which creates delays and extra costs. direct fed access means faster, cheaper transactions. better user experience, lower fees for us.

basically expect volatility around the announcement as markets love clarity. if this goes well, it removes a lot of regulatory overhang that's been suppressing prices. institutional adoption becomes easier when the rules are clear. one side benefit of clearer regulations is that tax compliance should get easier too. right now everyone's guessing at how to report crypto transactions, but solid regulatory framework means platforms like awaken.tax can build better tools knowing the rules won't change every six months. less regulatory confusion equals better user experience across the board.

the bottom line is that this feels like a turning point. either crypto gets the regulatory clarity it needs to explode, or we get buried under bureaucracy. the july 30 report won't give us all the answers, but it'll show us which direction we're headed.

anyone else watching this closely? what are you expecting from the announcement?",https://www.reddit.com/r/CryptoMarkets/comments/1m7mlx1/white_house_dropping_their_crypto_playbook_july/,97,48,1m7mlx1,reddit,CryptoMarkets
2025-07-23 18:23:27+00:00,"what would people say are the main difficulties when entering into the crypto market? i’m a 21yo guy who’s been involved in cryptocurrency and trading for a few years now. i’ve been through the highs and lows from btc pumping over the past few months and being the victim of a few rug pulls in the wild west of memecoins. i’ve managed to make some decent money (nothing life changing but i’m pretty happy with what i’ve managed to achieve). i’m interested to hear what everyone’s experiences has been since they started crypto (i.e., what made you get into it, what were the hurdles you faced and how you overcame them etc.,)?",https://www.reddit.com/r/CryptoMarkets/comments/1m7gyci/what_would_people_say_are_the_main_difficulties/,14,38,1m7gyci,reddit,CryptoMarkets
2025-07-23 01:08:32+00:00,"regretting future trading i have been trading for past 2-3 months, and at start i started spot trading was going good at it for reference im a student of business have done my batch lours and aiming for a masters program, life has been good, always had money management in me and spent wisely always, i knew about crypto currencies from a long time(3 years back)but never really invested in them.
recently a friend started trading in order to preserve savings  for upcoming years so i did too
i was doing good in spot trading mainly i was investing in btc, eth and sol coin
made good amount of profits
but eventually greed took me😔
i downloaded another trading app and pulled out my some money from spot account from different application and transferred those funds to my new application futures
i started loosing money from that day
leverages took the best of me
i was stupid enough to gamble huge amounts of money
i have learned it a very hard way
i am a student and couldn’t afford losing the amount of capital i have lost so far that would be around 1000$
now im going insane and looking back to it makes me hate myself
sometimes the greed makes me think that i wish i could have went for short at that time or i wish i could have went for long at that time
anways moving forward to this day i have swore to never ever use future again no matter how lucrative they are , 
future trading is total bullshit in my opnion even if you are calculating risks and all 
it makes you cripple
whomever is reading this post of mine and is new to trading 
please i advise you to just do spot trading
in longer run you would always be beneficial from this spot trading
you have the asset in your hands no matter even if it looses it value
do dca whenever you can 
never ever go for future trading
i have roughly calculated my loss so far now its roughly 1000$ could be more
and for me 1000$ is huge amount of money
im regretting my decision to ever go for futures",https://www.reddit.com/r/CryptoMarkets/comments/1m6vtoj/regretting_future_trading/,2,27,1m6vtoj,reddit,CryptoMarkets
2025-07-22 15:39:18+00:00,"report by oobit shows brazil’s crypto economy believes in usdt, but can’t use it according to a [july 2025 survey by oobit](https://www.ccn.com/news/crypto/brazils-crypto-economy-usdt-cant-use-it/), brazilian crypto users are deeply invested in stablecoins, particularly usdt:

- 91.8% of crypto users hold stablecoins

- 83% specifically hold usdt

- 43.5% fully trust tether

yet, despite the trust and popularity, actual usage remains surprisingly low:

- only 54.3% have ever made a crypto payment

- just 37% have used usdt in real-world scenarios (either online or offline)


the report suggests the problem isn’t technological but related to product, user experience, and real-world incentives.


i'm curious to hear your thoughts on this.


if you're in brazil or a similar market, what’s stopping you from spending crypto regularly?


what would make crypto-native spending easier or more rewarding?


are we finally past the ""starbucks with bitcoin"" era, or is mass adoption just waiting for the right infrastructure?",https://www.reddit.com/r/CryptoMarkets/comments/1m6hfhl/report_by_oobit_shows_brazils_crypto_economy/,42,9,1m6hfhl,reddit,CryptoMarkets
2025-07-22 14:52:05+00:00,"what if the altseason has already started — and we just haven’t admitted it yet? there’s been a lot of talk lately about how btc has ""decoupled"" from altcoins, that capital isn’t rotating like before, and that the altseason is still far away.

but honestly, looking at what’s happening across the board, i’m starting to wonder if we’re already *in the middle of it*, just in a more subtle form.

some signs that caught my attention:

**$sol broke above $200** recently, with strong momentum and bullish setups.

**$spk (spark)** is pumping post-airdrop, and its tvl just hit $8.15b — an all-time high.

several solana memecoins are doing **3x–5x within days**.

and perhaps most surprisingly: **bitget’s new listings in july massively outperformed**.

→ 1 token did a 10x 

→ 6 tokens did over 3x 

→ **average ath roi: \~279%**, with **\~99% still active** as of july 18.

i came across these stats from a tweet by [https://x.com/rovercrc/status/1947269763765248173](https://x.com/rovercrc/status/1947269763765248173), and honestly, i thought i was the only one noticing this kind of trend...

so here’s what i’m asking:

👉 **are we already in a “slow-burn altseason”** that most people are just ignoring?  
👉 or is this just the warm-up before a true altseason blow-off top?  
👉 is now the time to take profits or to hold and prepare for a second wave?

genuinely curious about your thoughts  especially from people actively trading low caps, new listings, or tracking tvl/momentum data.  
the market feels more alive than many seem to think.",https://www.reddit.com/r/CryptoMarkets/comments/1m6g69q/what_if_the_altseason_has_already_started_and_we/,1,9,1m6g69q,reddit,CryptoMarkets
2025-07-22 11:16:36+00:00,the ultimate reminder: bitcoin is time.,https://inbitcoinwetrust.substack.com/p/the-ultimate-reminder-bitcoin-is,4,0,1m6bc69,reddit,CryptoMarkets
2025-07-21 22:08:00+00:00,partial home 🏠 loan against my bitcoin? is it a good time to experiment taking a little loan from morpho/coinbase against my bitcoin asset for a few years? i’m thinking of using it towards my home. hoping it will somewhat compensate for the high mortgage rate being charged by my bank.,https://www.reddit.com/r/CryptoMarkets/comments/1m5wlb5/partial_home_loan_against_my_bitcoin/,0,1,1m5wlb5,reddit,CryptoMarkets
2025-07-22 06:46:14+00:00,"70/20/10 btc can someone explain the 70/20/10 investment strategy for btc mstr and msty. how does it benefit vs just investing in btc. also where do you drip the dividend returns from msty, do they go back into msty mstr or btc. and what is the 5-10 year goal/outlook for this type of strategy",https://www.reddit.com/r/CryptoMarkets/comments/1m670o0/702010_btc/,3,2,1m670o0,reddit,CryptoMarkets
2025-07-22 02:37:07+00:00,"explain why we need stablecoins like i‘m 5 so i’ve been seeing stablecoins like usdc and usdt mentioned a lot lately, but i still don’t really get what makes them useful. if they’re just pegged to the dollar, and the dollar is constantly losing value to inflation, then why would i want to park assets in a dollar-backed coin?

also, how does a company like circle make money just by “issuing” a coin like usdc? isn’t it just like printing digital dollars?

i usually just use usd when buying btc on robinhood or coinbase. i don’t go out of my way to buy stablecoins first. what’s the point of converting to a stablecoin if it’s just another version of cash? why do i need stablecoins exactly?",https://www.reddit.com/r/CryptoMarkets/comments/1m62j6i/explain_why_we_need_stablecoins_like_im_5/,65,98,1m62j6i,reddit,CryptoMarkets
2025-07-22 06:07:44+00:00,"in your view, what are potentially the biggest winners in this bull run? i mean by market cap of course.

in my opinion (other than btc of course), solana, ethereum, xrp, cardano, and a lot of the others are all ""safe havens"" that will go

what's something that has a lot of hype but not that much market cap? last time round it was solana and fantom (now sonic) that pretty much 100x-ed. what coins do you guys believe have that ability this time round?

sui has potential but i think it's market cap is already too high, plus that recent hack made me a feel little concerned about it. idk, i can't find any potentially underpriced projects with that much hype this time",https://www.reddit.com/r/CryptoMarkets/comments/1m66ex9/in_your_view_what_are_potentially_the_biggest/,29,82,1m66ex9,reddit,CryptoMarkets
2025-07-22 05:04:17+00:00,"xrp or btc i am currently doing my research and crypto. 
i know btc is top right now and will be forever.
xrp is kind of cheap per coin at the moment. should i buy btc only or try my luck with xrp.",https://www.reddit.com/r/CryptoMarkets/comments/1m65cpl/xrp_or_btc/,47,214,1m65cpl,reddit,CryptoMarkets
2025-07-22 01:24:08+00:00,"did btc price dropped as it's dominance dropped before? did btc price dropped as it's dominance dropped before? or the way a round?
what history shows about that?",https://www.reddit.com/r/CryptoMarkets/comments/1m6103x/did_btc_price_dropped_as_its_dominance_dropped/,13,30,1m6103x,reddit,CryptoMarkets
2025-07-22 00:27:51+00:00,random btc opinions if 1 was to start now and dca 2500 into btc monthly. what are the chances you reach 1 btc by next cycle top. shoot your opinions out,https://www.reddit.com/r/CryptoMarkets/comments/1m5ztiz/random_btc_opinions/,4,3,1m5ztiz,reddit,CryptoMarkets
2025-07-21 19:43:57+00:00,new and curious! hello! i’ve recently been able to start putting some money into crypto and i’m wondering if it would be better to sort of split my money into different coins or would it make more sense for me to slam my money into btc?,https://www.reddit.com/r/CryptoMarkets/comments/1m5suqj/new_and_curious/,1,3,1m5suqj,reddit,CryptoMarkets
2025-07-21 19:26:29+00:00,btc and alt season is not at the top yet i see so many posts saying should i sell and take gains is it too late? nobody knows obviously. but considering the instituional adaption and the new laws for crypto etc. we are still early.,https://www.reddit.com/r/CryptoMarkets/comments/1m5se0r/btc_and_alt_season_is_not_at_the_top_yet/,131,69,1m5se0r,reddit,CryptoMarkets
2025-07-21 17:03:46+00:00,"hold altcoins? hi everyone, i have a question. is it worth storing any altcoin long-term? i understand that you have to see what's behind it, how the project is going, etc., but i wanted to know if it's worth it, for example, to hold on to holdear, ltc, eth, bnb, sol, etc., or just bitcoin.",https://www.reddit.com/r/CryptoMarkets/comments/1m5oizj/hold_altcoins/,8,13,1m5oizj,reddit,CryptoMarkets
2025-07-21 17:02:54+00:00,"what gappened in the previous cycles that dropped prices? if i am not mistaken, we had 2 cycles (just saw btc and eth charts) so far. so only 2 cycles do not mean that crypto actually has cycles. 

what were the events that caused prices to drop both times?

maybe this time it goes higher and does not drop drastically?",https://www.reddit.com/r/CryptoMarkets/comments/1m5oi3o/what_gappened_in_the_previous_cycles_that_dropped/,4,22,1m5oi3o,reddit,CryptoMarkets
